number,value,datetime_start,datetime_complete,duration,params_feature_set_name,params_mlp_activation,params_mlp_alpha,params_mlp_batch_size,params_mlp_hidden_layer_sizes,params_mlp_learning_rate_init,params_mlp_tol,params_model_family,params_rf_bootstrap,params_rf_max_depth,params_rf_max_features,params_rf_min_samples_leaf,params_rf_min_samples_split,params_rf_n_estimators,user_attrs_cv_mae_mean,user_attrs_cv_r2_mean,user_attrs_cv_rmse_mean,user_attrs_cv_rmse_std,user_attrs_feature_list,user_attrs_feature_set_name,user_attrs_model_family,user_attrs_n_features,user_attrs_params_json,user_attrs_uses_current_city_crime_signal,state
55,8.726251022691272,2026-04-03 18:49:51.672316,2026-04-03 18:49:53.048889,0 days 00:00:01.376573,all_features,,,,,,,rf,True,20.0,0.7,3.0,9.0,400.0,6.356952322621599,0.6657329125650646,8.726251022691272,0.9986174706221056,dist_nearest_labeled_city | log1p_dist_nearest_labeled_city | crime_nearest_labeled_city | safety_nearest_labeled_city | same_country_as_nearest_labeled | avg_crime_k5 | avg_safety_k5 | avg_crime_k10 | avg_safety_k10 | wavg_crime_k5 | wavg_safety_k5 | log1p_num_labeled_within_50km | log1p_num_labeled_within_100km | log1p_num_labeled_within_250km | avg_crime_same_country_k5 | avg_safety_same_country_k5 | log1p_num_same_country_within_250km | log1p_num_cities_50km | log1p_sum_pop_50km | log1p_pop_gravity_50km | log1p_num_cities_100km | log1p_sum_pop_100km | log1p_pop_gravity_100km | dist_to_nearest_large_city | log1p_dist_to_nearest_large_city | log1p_pop_of_nearest_large_city | lat | lon | crimeindex_2020 | crimeindex_2023 | safetyindex_2020 | age_0_14 | age_15_64 | age_65_plus | population | density_per_km2 | gdp | gdp_per_capita | unemployment | homicide_rate | life_expectancy_male | life_expectancy_female | infant_mortality | urban_population_growth | tourists,all_features,rf,45.0,"{""bootstrap"": true, ""max_depth"": 20, ""max_features"": 0.7, ""min_samples_leaf"": 3, ""min_samples_split"": 9, ""n_estimators"": 400}",1.0,COMPLETE
56,8.758998011484712,2026-04-03 18:49:53.049750,2026-04-03 18:49:54.112844,0 days 00:00:01.063094,all_features,,,,,,,rf,True,20.0,0.7,3.0,10.0,300.0,6.381845320795987,0.6634182646949671,8.758998011484712,1.0101407610051225,dist_nearest_labeled_city | log1p_dist_nearest_labeled_city | crime_nearest_labeled_city | safety_nearest_labeled_city | same_country_as_nearest_labeled | avg_crime_k5 | avg_safety_k5 | avg_crime_k10 | avg_safety_k10 | wavg_crime_k5 | wavg_safety_k5 | log1p_num_labeled_within_50km | log1p_num_labeled_within_100km | log1p_num_labeled_within_250km | avg_crime_same_country_k5 | avg_safety_same_country_k5 | log1p_num_same_country_within_250km | log1p_num_cities_50km | log1p_sum_pop_50km | log1p_pop_gravity_50km | log1p_num_cities_100km | log1p_sum_pop_100km | log1p_pop_gravity_100km | dist_to_nearest_large_city | log1p_dist_to_nearest_large_city | log1p_pop_of_nearest_large_city | lat | lon | crimeindex_2020 | crimeindex_2023 | safetyindex_2020 | age_0_14 | age_15_64 | age_65_plus | population | density_per_km2 | gdp | gdp_per_capita | unemployment | homicide_rate | life_expectancy_male | life_expectancy_female | infant_mortality | urban_population_growth | tourists,all_features,rf,45.0,"{""bootstrap"": true, ""max_depth"": 20, ""max_features"": 0.7, ""min_samples_leaf"": 3, ""min_samples_split"": 10, ""n_estimators"": 300}",1.0,COMPLETE
57,10.501105312444203,2026-04-03 18:49:54.113479,2026-04-03 18:49:56.621822,0 days 00:00:02.508343,geo_knn_density,,,,,,,rf,True,8.0,0.7,3.0,9.0,900.0,7.919092033312843,0.5183590900339801,10.501105312444203,1.417710183186444,lat | lon | dist_nearest_labeled_city | log1p_dist_nearest_labeled_city | crime_nearest_labeled_city | safety_nearest_labeled_city | same_country_as_nearest_labeled | avg_crime_k5 | avg_safety_k5 | avg_crime_k10 | avg_safety_k10 | wavg_crime_k5 | wavg_safety_k5 | log1p_num_labeled_within_50km | log1p_num_labeled_within_100km | log1p_num_labeled_within_250km | avg_crime_same_country_k5 | avg_safety_same_country_k5 | log1p_num_same_country_within_250km | log1p_num_cities_50km | log1p_sum_pop_50km | log1p_pop_gravity_50km | log1p_num_cities_100km | log1p_sum_pop_100km | log1p_pop_gravity_100km | dist_to_nearest_large_city | log1p_dist_to_nearest_large_city | log1p_pop_of_nearest_large_city,geo_knn_density,rf,28.0,"{""bootstrap"": true, ""max_depth"": 8, ""max_features"": 0.7, ""min_samples_leaf"": 3, ""min_samples_split"": 9, ""n_estimators"": 900}",0.0,COMPLETE
58,12.833350844351177,2026-04-03 18:49:56.622468,2026-04-03 18:49:58.082361,0 days 00:00:01.459893,geo_only,relu,0.00012409888727654155,256.0,"(256, 128, 64)",0.0009910529977785823,0.0004426109816315004,mlp,,,,,,,,,,,,,,,,,PRUNED
59,8.769388693128882,2026-04-03 18:49:58.083030,2026-04-03 18:49:59.414439,0 days 00:00:01.331409,all_features,,,,,,,rf,True,20.0,0.7,3.0,10.0,400.0,6.393922463392939,0.6624426432885032,8.769388693128882,1.0131127404242057,dist_nearest_labeled_city | log1p_dist_nearest_labeled_city | crime_nearest_labeled_city | safety_nearest_labeled_city | same_country_as_nearest_labeled | avg_crime_k5 | avg_safety_k5 | avg_crime_k10 | avg_safety_k10 | wavg_crime_k5 | wavg_safety_k5 | log1p_num_labeled_within_50km | log1p_num_labeled_within_100km | log1p_num_labeled_within_250km | avg_crime_same_country_k5 | avg_safety_same_country_k5 | log1p_num_same_country_within_250km | log1p_num_cities_50km | log1p_sum_pop_50km | log1p_pop_gravity_50km | log1p_num_cities_100km | log1p_sum_pop_100km | log1p_pop_gravity_100km | dist_to_nearest_large_city | log1p_dist_to_nearest_large_city | log1p_pop_of_nearest_large_city | lat | lon | crimeindex_2020 | crimeindex_2023 | safetyindex_2020 | age_0_14 | age_15_64 | age_65_plus | population | density_per_km2 | gdp | gdp_per_capita | unemployment | homicide_rate | life_expectancy_male | life_expectancy_female | infant_mortality | urban_population_growth | tourists,all_features,rf,45.0,"{""bootstrap"": true, ""max_depth"": 20, ""max_features"": 0.7, ""min_samples_leaf"": 3, ""min_samples_split"": 10, ""n_estimators"": 400}",1.0,COMPLETE
60,8.758998011484712,2026-04-03 18:49:59.415101,2026-04-03 18:50:00.468045,0 days 00:00:01.052944,all_features,,,,,,,rf,True,20.0,0.7,3.0,10.0,300.0,6.381845320795988,0.6634182646949671,8.758998011484712,1.0101407610051223,dist_nearest_labeled_city | log1p_dist_nearest_labeled_city | crime_nearest_labeled_city | safety_nearest_labeled_city | same_country_as_nearest_labeled | avg_crime_k5 | avg_safety_k5 | avg_crime_k10 | avg_safety_k10 | wavg_crime_k5 | wavg_safety_k5 | log1p_num_labeled_within_50km | log1p_num_labeled_within_100km | log1p_num_labeled_within_250km | avg_crime_same_country_k5 | avg_safety_same_country_k5 | log1p_num_same_country_within_250km | log1p_num_cities_50km | log1p_sum_pop_50km | log1p_pop_gravity_50km | log1p_num_cities_100km | log1p_sum_pop_100km | log1p_pop_gravity_100km | dist_to_nearest_large_city | log1p_dist_to_nearest_large_city | log1p_pop_of_nearest_large_city | lat | lon | crimeindex_2020 | crimeindex_2023 | safetyindex_2020 | age_0_14 | age_15_64 | age_65_plus | population | density_per_km2 | gdp | gdp_per_capita | unemployment | homicide_rate | life_expectancy_male | life_expectancy_female | infant_mortality | urban_population_growth | tourists,all_features,rf,45.0,"{""bootstrap"": true, ""max_depth"": 20, ""max_features"": 0.7, ""min_samples_leaf"": 3, ""min_samples_split"": 10, ""n_estimators"": 300}",1.0,COMPLETE
61,8.709878164070952,2026-04-03 18:50:00.468684,2026-04-03 18:50:01.524911,0 days 00:00:01.056227,all_features,,,,,,,rf,True,20.0,0.7,3.0,9.0,300.0,6.346887646771371,0.6671705430432292,8.709878164070952,1.0087580788150903,dist_nearest_labeled_city | log1p_dist_nearest_labeled_city | crime_nearest_labeled_city | safety_nearest_labeled_city | same_country_as_nearest_labeled | avg_crime_k5 | avg_safety_k5 | avg_crime_k10 | avg_safety_k10 | wavg_crime_k5 | wavg_safety_k5 | log1p_num_labeled_within_50km | log1p_num_labeled_within_100km | log1p_num_labeled_within_250km | avg_crime_same_country_k5 | avg_safety_same_country_k5 | log1p_num_same_country_within_250km | log1p_num_cities_50km | log1p_sum_pop_50km | log1p_pop_gravity_50km | log1p_num_cities_100km | log1p_sum_pop_100km | log1p_pop_gravity_100km | dist_to_nearest_large_city | log1p_dist_to_nearest_large_city | log1p_pop_of_nearest_large_city | lat | lon | crimeindex_2020 | crimeindex_2023 | safetyindex_2020 | age_0_14 | age_15_64 | age_65_plus | population | density_per_km2 | gdp | gdp_per_capita | unemployment | homicide_rate | life_expectancy_male | life_expectancy_female | infant_mortality | urban_population_growth | tourists,all_features,rf,45.0,"{""bootstrap"": true, ""max_depth"": 20, ""max_features"": 0.7, ""min_samples_leaf"": 3, ""min_samples_split"": 9, ""n_estimators"": 300}",1.0,COMPLETE
62,8.726251022691272,2026-04-03 18:50:01.525543,2026-04-03 18:50:02.862355,0 days 00:00:01.336812,all_features,,,,,,,rf,True,20.0,0.7,3.0,9.0,400.0,6.356952322621599,0.6657329125650648,8.726251022691272,0.9986174706221055,dist_nearest_labeled_city | log1p_dist_nearest_labeled_city | crime_nearest_labeled_city | safety_nearest_labeled_city | same_country_as_nearest_labeled | avg_crime_k5 | avg_safety_k5 | avg_crime_k10 | avg_safety_k10 | wavg_crime_k5 | wavg_safety_k5 | log1p_num_labeled_within_50km | log1p_num_labeled_within_100km | log1p_num_labeled_within_250km | avg_crime_same_country_k5 | avg_safety_same_country_k5 | log1p_num_same_country_within_250km | log1p_num_cities_50km | log1p_sum_pop_50km | log1p_pop_gravity_50km | log1p_num_cities_100km | log1p_sum_pop_100km | log1p_pop_gravity_100km | dist_to_nearest_large_city | log1p_dist_to_nearest_large_city | log1p_pop_of_nearest_large_city | lat | lon | crimeindex_2020 | crimeindex_2023 | safetyindex_2020 | age_0_14 | age_15_64 | age_65_plus | population | density_per_km2 | gdp | gdp_per_capita | unemployment | homicide_rate | life_expectancy_male | life_expectancy_female | infant_mortality | urban_population_growth | tourists,all_features,rf,45.0,"{""bootstrap"": true, ""max_depth"": 20, ""max_features"": 0.7, ""min_samples_leaf"": 3, ""min_samples_split"": 9, ""n_estimators"": 400}",1.0,COMPLETE
63,8.709878164070954,2026-04-03 18:50:02.862987,2026-04-03 18:50:03.909884,0 days 00:00:01.046897,all_features,,,,,,,rf,True,20.0,0.7,3.0,9.0,300.0,6.346887646771371,0.6671705430432291,8.709878164070954,1.00875807881509,dist_nearest_labeled_city | log1p_dist_nearest_labeled_city | crime_nearest_labeled_city | safety_nearest_labeled_city | same_country_as_nearest_labeled | avg_crime_k5 | avg_safety_k5 | avg_crime_k10 | avg_safety_k10 | wavg_crime_k5 | wavg_safety_k5 | log1p_num_labeled_within_50km | log1p_num_labeled_within_100km | log1p_num_labeled_within_250km | avg_crime_same_country_k5 | avg_safety_same_country_k5 | log1p_num_same_country_within_250km | log1p_num_cities_50km | log1p_sum_pop_50km | log1p_pop_gravity_50km | log1p_num_cities_100km | log1p_sum_pop_100km | log1p_pop_gravity_100km | dist_to_nearest_large_city | log1p_dist_to_nearest_large_city | log1p_pop_of_nearest_large_city | lat | lon | crimeindex_2020 | crimeindex_2023 | safetyindex_2020 | age_0_14 | age_15_64 | age_65_plus | population | density_per_km2 | gdp | gdp_per_capita | unemployment | homicide_rate | life_expectancy_male | life_expectancy_female | infant_mortality | urban_population_growth | tourists,all_features,rf,45.0,"{""bootstrap"": true, ""max_depth"": 20, ""max_features"": 0.7, ""min_samples_leaf"": 3, ""min_samples_split"": 9, ""n_estimators"": 300}",1.0,COMPLETE
64,10.254572961781598,2026-04-03 18:50:03.910504,2026-04-03 18:50:04.264890,0 days 00:00:00.354386,geo_macro,,,,,,,rf,True,,0.7,3.0,8.0,300.0,,,,,,,,,,,PRUNED
65,9.088676613153563,2026-04-03 18:50:04.265480,2026-04-03 18:50:05.404815,0 days 00:00:01.139335,all_features,,,,,,,rf,True,20.0,log2,3.0,9.0,400.0,6.916122436849368,0.6390436749629058,9.088676613153563,1.1432438043567348,dist_nearest_labeled_city | log1p_dist_nearest_labeled_city | crime_nearest_labeled_city | safety_nearest_labeled_city | same_country_as_nearest_labeled | avg_crime_k5 | avg_safety_k5 | avg_crime_k10 | avg_safety_k10 | wavg_crime_k5 | wavg_safety_k5 | log1p_num_labeled_within_50km | log1p_num_labeled_within_100km | log1p_num_labeled_within_250km | avg_crime_same_country_k5 | avg_safety_same_country_k5 | log1p_num_same_country_within_250km | log1p_num_cities_50km | log1p_sum_pop_50km | log1p_pop_gravity_50km | log1p_num_cities_100km | log1p_sum_pop_100km | log1p_pop_gravity_100km | dist_to_nearest_large_city | log1p_dist_to_nearest_large_city | log1p_pop_of_nearest_large_city | lat | lon | crimeindex_2020 | crimeindex_2023 | safetyindex_2020 | age_0_14 | age_15_64 | age_65_plus | population | density_per_km2 | gdp | gdp_per_capita | unemployment | homicide_rate | life_expectancy_male | life_expectancy_female | infant_mortality | urban_population_growth | tourists,all_features,rf,45.0,"{""bootstrap"": true, ""max_depth"": 20, ""max_features"": ""log2"", ""min_samples_leaf"": 3, ""min_samples_split"": 9, ""n_estimators"": 400}",1.0,COMPLETE
66,9.750481380618401,2026-04-03 18:50:05.405440,2026-04-03 18:50:06.600665,0 days 00:00:01.195225,all_features,,,,,,,rf,False,12.0,0.7,3.0,5.0,300.0,7.066572636227429,0.5767563910598618,9.750481380618401,1.1033966224226839,dist_nearest_labeled_city | log1p_dist_nearest_labeled_city | crime_nearest_labeled_city | safety_nearest_labeled_city | same_country_as_nearest_labeled | avg_crime_k5 | avg_safety_k5 | avg_crime_k10 | avg_safety_k10 | wavg_crime_k5 | wavg_safety_k5 | log1p_num_labeled_within_50km | log1p_num_labeled_within_100km | log1p_num_labeled_within_250km | avg_crime_same_country_k5 | avg_safety_same_country_k5 | log1p_num_same_country_within_250km | log1p_num_cities_50km | log1p_sum_pop_50km | log1p_pop_gravity_50km | log1p_num_cities_100km | log1p_sum_pop_100km | log1p_pop_gravity_100km | dist_to_nearest_large_city | log1p_dist_to_nearest_large_city | log1p_pop_of_nearest_large_city | lat | lon | crimeindex_2020 | crimeindex_2023 | safetyindex_2020 | age_0_14 | age_15_64 | age_65_plus | population | density_per_km2 | gdp | gdp_per_capita | unemployment | homicide_rate | life_expectancy_male | life_expectancy_female | infant_mortality | urban_population_growth | tourists,all_features,rf,45.0,"{""bootstrap"": false, ""max_depth"": 12, ""max_features"": 0.7, ""min_samples_leaf"": 3, ""min_samples_split"": 5, ""n_estimators"": 300}",1.0,COMPLETE
67,10.499646251537921,2026-04-03 18:50:06.601347,2026-04-03 18:50:07.805308,0 days 00:00:01.203961,geo_knn_density,,,,,,,rf,True,20.0,0.7,3.0,10.0,400.0,7.8963299384852474,0.5181148651775667,10.499646251537921,1.459550361441521,lat | lon | dist_nearest_labeled_city | log1p_dist_nearest_labeled_city | crime_nearest_labeled_city | safety_nearest_labeled_city | same_country_as_nearest_labeled | avg_crime_k5 | avg_safety_k5 | avg_crime_k10 | avg_safety_k10 | wavg_crime_k5 | wavg_safety_k5 | log1p_num_labeled_within_50km | log1p_num_labeled_within_100km | log1p_num_labeled_within_250km | avg_crime_same_country_k5 | avg_safety_same_country_k5 | log1p_num_same_country_within_250km | log1p_num_cities_50km | log1p_sum_pop_50km | log1p_pop_gravity_50km | log1p_num_cities_100km | log1p_sum_pop_100km | log1p_pop_gravity_100km | dist_to_nearest_large_city | log1p_dist_to_nearest_large_city | log1p_pop_of_nearest_large_city,geo_knn_density,rf,28.0,"{""bootstrap"": true, ""max_depth"": 20, ""max_features"": 0.7, ""min_samples_leaf"": 3, ""min_samples_split"": 10, ""n_estimators"": 400}",0.0,COMPLETE
68,8.803590083285949,2026-04-03 18:50:07.805931,2026-04-03 18:50:08.848279,0 days 00:00:01.042348,all_features,,,,,,,rf,True,8.0,0.7,3.0,10.0,300.0,6.477190401032152,0.6600434780025375,8.803590083285949,1.0308076529666805,dist_nearest_labeled_city | log1p_dist_nearest_labeled_city | crime_nearest_labeled_city | safety_nearest_labeled_city | same_country_as_nearest_labeled | avg_crime_k5 | avg_safety_k5 | avg_crime_k10 | avg_safety_k10 | wavg_crime_k5 | wavg_safety_k5 | log1p_num_labeled_within_50km | log1p_num_labeled_within_100km | log1p_num_labeled_within_250km | avg_crime_same_country_k5 | avg_safety_same_country_k5 | log1p_num_same_country_within_250km | log1p_num_cities_50km | log1p_sum_pop_50km | log1p_pop_gravity_50km | log1p_num_cities_100km | log1p_sum_pop_100km | log1p_pop_gravity_100km | dist_to_nearest_large_city | log1p_dist_to_nearest_large_city | log1p_pop_of_nearest_large_city | lat | lon | crimeindex_2020 | crimeindex_2023 | safetyindex_2020 | age_0_14 | age_15_64 | age_65_plus | population | density_per_km2 | gdp | gdp_per_capita | unemployment | homicide_rate | life_expectancy_male | life_expectancy_female | infant_mortality | urban_population_growth | tourists,all_features,rf,45.0,"{""bootstrap"": true, ""max_depth"": 8, ""max_features"": 0.7, ""min_samples_leaf"": 3, ""min_samples_split"": 10, ""n_estimators"": 300}",1.0,COMPLETE
69,11.092769808749502,2026-04-03 18:50:08.848928,2026-04-03 18:50:09.284733,0 days 00:00:00.435805,geo_only,,,,,,,rf,True,20.0,0.7,3.0,9.0,400.0,,,,,,,,,,,PRUNED
70,8.734775301354725,2026-04-03 18:50:09.285335,2026-04-03 18:50:10.357012,0 days 00:00:01.071677,all_features,,,,,,,rf,True,20.0,0.7,3.0,8.0,300.0,6.34659685902488,0.6650224757012755,8.734775301354725,1.0191180393321813,dist_nearest_labeled_city | log1p_dist_nearest_labeled_city | crime_nearest_labeled_city | safety_nearest_labeled_city | same_country_as_nearest_labeled | avg_crime_k5 | avg_safety_k5 | avg_crime_k10 | avg_safety_k10 | wavg_crime_k5 | wavg_safety_k5 | log1p_num_labeled_within_50km | log1p_num_labeled_within_100km | log1p_num_labeled_within_250km | avg_crime_same_country_k5 | avg_safety_same_country_k5 | log1p_num_same_country_within_250km | log1p_num_cities_50km | log1p_sum_pop_50km | log1p_pop_gravity_50km | log1p_num_cities_100km | log1p_sum_pop_100km | log1p_pop_gravity_100km | dist_to_nearest_large_city | log1p_dist_to_nearest_large_city | log1p_pop_of_nearest_large_city | lat | lon | crimeindex_2020 | crimeindex_2023 | safetyindex_2020 | age_0_14 | age_15_64 | age_65_plus | population | density_per_km2 | gdp | gdp_per_capita | unemployment | homicide_rate | life_expectancy_male | life_expectancy_female | infant_mortality | urban_population_growth | tourists,all_features,rf,45.0,"{""bootstrap"": true, ""max_depth"": 20, ""max_features"": 0.7, ""min_samples_leaf"": 3, ""min_samples_split"": 8, ""n_estimators"": 300}",1.0,COMPLETE
71,8.709878164070952,2026-04-03 18:50:10.357634,2026-04-03 18:50:11.392383,0 days 00:00:01.034749,all_features,,,,,,,rf,True,20.0,0.7,3.0,9.0,300.0,6.3468876467713695,0.6671705430432292,8.709878164070952,1.0087580788150903,dist_nearest_labeled_city | log1p_dist_nearest_labeled_city | crime_nearest_labeled_city | safety_nearest_labeled_city | same_country_as_nearest_labeled | avg_crime_k5 | avg_safety_k5 | avg_crime_k10 | avg_safety_k10 | wavg_crime_k5 | wavg_safety_k5 | log1p_num_labeled_within_50km | log1p_num_labeled_within_100km | log1p_num_labeled_within_250km | avg_crime_same_country_k5 | avg_safety_same_country_k5 | log1p_num_same_country_within_250km | log1p_num_cities_50km | log1p_sum_pop_50km | log1p_pop_gravity_50km | log1p_num_cities_100km | log1p_sum_pop_100km | log1p_pop_gravity_100km | dist_to_nearest_large_city | log1p_dist_to_nearest_large_city | log1p_pop_of_nearest_large_city | lat | lon | crimeindex_2020 | crimeindex_2023 | safetyindex_2020 | age_0_14 | age_15_64 | age_65_plus | population | density_per_km2 | gdp | gdp_per_capita | unemployment | homicide_rate | life_expectancy_male | life_expectancy_female | infant_mortality | urban_population_growth | tourists,all_features,rf,45.0,"{""bootstrap"": true, ""max_depth"": 20, ""max_features"": 0.7, ""min_samples_leaf"": 3, ""min_samples_split"": 9, ""n_estimators"": 300}",1.0,COMPLETE
72,8.709878164070952,2026-04-03 18:50:11.393018,2026-04-03 18:50:12.448693,0 days 00:00:01.055675,all_features,,,,,,,rf,True,20.0,0.7,3.0,9.0,300.0,6.346887646771371,0.6671705430432292,8.709878164070952,1.00875807881509,dist_nearest_labeled_city | log1p_dist_nearest_labeled_city | crime_nearest_labeled_city | safety_nearest_labeled_city | same_country_as_nearest_labeled | avg_crime_k5 | avg_safety_k5 | avg_crime_k10 | avg_safety_k10 | wavg_crime_k5 | wavg_safety_k5 | log1p_num_labeled_within_50km | log1p_num_labeled_within_100km | log1p_num_labeled_within_250km | avg_crime_same_country_k5 | avg_safety_same_country_k5 | log1p_num_same_country_within_250km | log1p_num_cities_50km | log1p_sum_pop_50km | log1p_pop_gravity_50km | log1p_num_cities_100km | log1p_sum_pop_100km | log1p_pop_gravity_100km | dist_to_nearest_large_city | log1p_dist_to_nearest_large_city | log1p_pop_of_nearest_large_city | lat | lon | crimeindex_2020 | crimeindex_2023 | safetyindex_2020 | age_0_14 | age_15_64 | age_65_plus | population | density_per_km2 | gdp | gdp_per_capita | unemployment | homicide_rate | life_expectancy_male | life_expectancy_female | infant_mortality | urban_population_growth | tourists,all_features,rf,45.0,"{""bootstrap"": true, ""max_depth"": 20, ""max_features"": 0.7, ""min_samples_leaf"": 3, ""min_samples_split"": 9, ""n_estimators"": 300}",1.0,COMPLETE
