number,value,datetime_start,datetime_complete,duration,params_feature_set_name,params_mlp_activation,params_mlp_alpha,params_mlp_batch_size,params_mlp_hidden_layer_sizes,params_mlp_learning_rate_init,params_mlp_tol,params_model_family,params_rf_bootstrap,params_rf_max_depth,params_rf_max_features,params_rf_min_samples_leaf,params_rf_min_samples_split,params_rf_n_estimators,user_attrs_cv_mae_mean,user_attrs_cv_r2_mean,user_attrs_cv_rmse_mean,user_attrs_cv_rmse_std,user_attrs_feature_list,user_attrs_feature_set_name,user_attrs_model_family,user_attrs_n_features,user_attrs_params_json,user_attrs_uses_current_city_crime_signal,state
36,9.242471835021266,2026-04-03 18:49:21.573053,2026-04-03 18:49:23.902450,0 days 00:00:02.329397,all_features,tanh,0.0042551613068481904,128.0,"(256,)",0.0019225598216111965,0.0008108079355271541,mlp,,,,,,,6.8269424246295625,0.6229333930299168,9.242471835021266,0.9113514112057791,dist_nearest_labeled_city | log1p_dist_nearest_labeled_city | crime_nearest_labeled_city | safety_nearest_labeled_city | same_country_as_nearest_labeled | avg_crime_k5 | avg_safety_k5 | avg_crime_k10 | avg_safety_k10 | wavg_crime_k5 | wavg_safety_k5 | log1p_num_labeled_within_50km | log1p_num_labeled_within_100km | log1p_num_labeled_within_250km | avg_crime_same_country_k5 | avg_safety_same_country_k5 | log1p_num_same_country_within_250km | log1p_num_cities_50km | log1p_sum_pop_50km | log1p_pop_gravity_50km | log1p_num_cities_100km | log1p_sum_pop_100km | log1p_pop_gravity_100km | dist_to_nearest_large_city | log1p_dist_to_nearest_large_city | log1p_pop_of_nearest_large_city | lat | lon | crimeindex_2020 | crimeindex_2023 | safetyindex_2020 | age_0_14 | age_15_64 | age_65_plus | population | density_per_km2 | gdp | gdp_per_capita | unemployment | homicide_rate | life_expectancy_male | life_expectancy_female | infant_mortality | urban_population_growth | tourists,all_features,mlp,45.0,"{""activation"": ""tanh"", ""alpha"": 0.0042551613068481904, ""batch_size"": 128, ""hidden_layer_sizes"": [256], ""learning_rate_init"": 0.0019225598216111965, ""tol"": 0.0008108079355271541}",1.0,COMPLETE
37,8.75494314739558,2026-04-03 18:49:23.903337,2026-04-03 18:49:24.674494,0 days 00:00:00.771157,all_features,,,,,,,rf,True,16.0,0.9,4.0,7.0,200.0,6.3792414271557485,0.6635270479307556,8.75494314739558,0.9921732259789372,dist_nearest_labeled_city | log1p_dist_nearest_labeled_city | crime_nearest_labeled_city | safety_nearest_labeled_city | same_country_as_nearest_labeled | avg_crime_k5 | avg_safety_k5 | avg_crime_k10 | avg_safety_k10 | wavg_crime_k5 | wavg_safety_k5 | log1p_num_labeled_within_50km | log1p_num_labeled_within_100km | log1p_num_labeled_within_250km | avg_crime_same_country_k5 | avg_safety_same_country_k5 | log1p_num_same_country_within_250km | log1p_num_cities_50km | log1p_sum_pop_50km | log1p_pop_gravity_50km | log1p_num_cities_100km | log1p_sum_pop_100km | log1p_pop_gravity_100km | dist_to_nearest_large_city | log1p_dist_to_nearest_large_city | log1p_pop_of_nearest_large_city | lat | lon | crimeindex_2020 | crimeindex_2023 | safetyindex_2020 | age_0_14 | age_15_64 | age_65_plus | population | density_per_km2 | gdp | gdp_per_capita | unemployment | homicide_rate | life_expectancy_male | life_expectancy_female | infant_mortality | urban_population_growth | tourists,all_features,rf,45.0,"{""bootstrap"": true, ""max_depth"": 16, ""max_features"": 0.9, ""min_samples_leaf"": 4, ""min_samples_split"": 7, ""n_estimators"": 200}",1.0,COMPLETE
38,10.328173736744962,2026-04-03 18:49:24.675179,2026-04-03 18:49:25.548919,0 days 00:00:00.873740,all_features,,,,,,,rf,False,16.0,0.9,4.0,8.0,200.0,7.624892759201913,0.524345901073916,10.328173736744962,1.261076717633799,dist_nearest_labeled_city | log1p_dist_nearest_labeled_city | crime_nearest_labeled_city | safety_nearest_labeled_city | same_country_as_nearest_labeled | avg_crime_k5 | avg_safety_k5 | avg_crime_k10 | avg_safety_k10 | wavg_crime_k5 | wavg_safety_k5 | log1p_num_labeled_within_50km | log1p_num_labeled_within_100km | log1p_num_labeled_within_250km | avg_crime_same_country_k5 | avg_safety_same_country_k5 | log1p_num_same_country_within_250km | log1p_num_cities_50km | log1p_sum_pop_50km | log1p_pop_gravity_50km | log1p_num_cities_100km | log1p_sum_pop_100km | log1p_pop_gravity_100km | dist_to_nearest_large_city | log1p_dist_to_nearest_large_city | log1p_pop_of_nearest_large_city | lat | lon | crimeindex_2020 | crimeindex_2023 | safetyindex_2020 | age_0_14 | age_15_64 | age_65_plus | population | density_per_km2 | gdp | gdp_per_capita | unemployment | homicide_rate | life_expectancy_male | life_expectancy_female | infant_mortality | urban_population_growth | tourists,all_features,rf,45.0,"{""bootstrap"": false, ""max_depth"": 16, ""max_features"": 0.9, ""min_samples_leaf"": 4, ""min_samples_split"": 8, ""n_estimators"": 200}",1.0,COMPLETE
39,13.59663433356135,2026-04-03 18:49:25.549551,2026-04-03 18:49:36.038390,0 days 00:00:10.488839,all_features,tanh,0.0008863992205940699,128.0,"(256, 128, 64)",0.000569486286601194,1.2315754092233008e-05,mlp,,,,,,,,,,,,,,,,,PRUNED
40,8.824640078051022,2026-04-03 18:49:36.039063,2026-04-03 18:49:36.770709,0 days 00:00:00.731646,all_features,,,,,,,rf,True,16.0,0.9,5.0,7.0,200.0,6.451844260385988,0.6578066496541922,8.824640078051022,1.0388022913880444,dist_nearest_labeled_city | log1p_dist_nearest_labeled_city | crime_nearest_labeled_city | safety_nearest_labeled_city | same_country_as_nearest_labeled | avg_crime_k5 | avg_safety_k5 | avg_crime_k10 | avg_safety_k10 | wavg_crime_k5 | wavg_safety_k5 | log1p_num_labeled_within_50km | log1p_num_labeled_within_100km | log1p_num_labeled_within_250km | avg_crime_same_country_k5 | avg_safety_same_country_k5 | log1p_num_same_country_within_250km | log1p_num_cities_50km | log1p_sum_pop_50km | log1p_pop_gravity_50km | log1p_num_cities_100km | log1p_sum_pop_100km | log1p_pop_gravity_100km | dist_to_nearest_large_city | log1p_dist_to_nearest_large_city | log1p_pop_of_nearest_large_city | lat | lon | crimeindex_2020 | crimeindex_2023 | safetyindex_2020 | age_0_14 | age_15_64 | age_65_plus | population | density_per_km2 | gdp | gdp_per_capita | unemployment | homicide_rate | life_expectancy_male | life_expectancy_female | infant_mortality | urban_population_growth | tourists,all_features,rf,45.0,"{""bootstrap"": true, ""max_depth"": 16, ""max_features"": 0.9, ""min_samples_leaf"": 5, ""min_samples_split"": 7, ""n_estimators"": 200}",1.0,COMPLETE
41,8.824640078051022,2026-04-03 18:49:36.771387,2026-04-03 18:49:37.516419,0 days 00:00:00.745032,all_features,,,,,,,rf,True,16.0,0.9,5.0,7.0,200.0,6.451844260385987,0.6578066496541922,8.824640078051022,1.0388022913880448,dist_nearest_labeled_city | log1p_dist_nearest_labeled_city | crime_nearest_labeled_city | safety_nearest_labeled_city | same_country_as_nearest_labeled | avg_crime_k5 | avg_safety_k5 | avg_crime_k10 | avg_safety_k10 | wavg_crime_k5 | wavg_safety_k5 | log1p_num_labeled_within_50km | log1p_num_labeled_within_100km | log1p_num_labeled_within_250km | avg_crime_same_country_k5 | avg_safety_same_country_k5 | log1p_num_same_country_within_250km | log1p_num_cities_50km | log1p_sum_pop_50km | log1p_pop_gravity_50km | log1p_num_cities_100km | log1p_sum_pop_100km | log1p_pop_gravity_100km | dist_to_nearest_large_city | log1p_dist_to_nearest_large_city | log1p_pop_of_nearest_large_city | lat | lon | crimeindex_2020 | crimeindex_2023 | safetyindex_2020 | age_0_14 | age_15_64 | age_65_plus | population | density_per_km2 | gdp | gdp_per_capita | unemployment | homicide_rate | life_expectancy_male | life_expectancy_female | infant_mortality | urban_population_growth | tourists,all_features,rf,45.0,"{""bootstrap"": true, ""max_depth"": 16, ""max_features"": 0.9, ""min_samples_leaf"": 5, ""min_samples_split"": 7, ""n_estimators"": 200}",1.0,COMPLETE
42,8.75494314739558,2026-04-03 18:49:37.517027,2026-04-03 18:49:38.292871,0 days 00:00:00.775844,all_features,,,,,,,rf,True,16.0,0.9,4.0,7.0,200.0,6.379241427155748,0.6635270479307556,8.75494314739558,0.992173225978937,dist_nearest_labeled_city | log1p_dist_nearest_labeled_city | crime_nearest_labeled_city | safety_nearest_labeled_city | same_country_as_nearest_labeled | avg_crime_k5 | avg_safety_k5 | avg_crime_k10 | avg_safety_k10 | wavg_crime_k5 | wavg_safety_k5 | log1p_num_labeled_within_50km | log1p_num_labeled_within_100km | log1p_num_labeled_within_250km | avg_crime_same_country_k5 | avg_safety_same_country_k5 | log1p_num_same_country_within_250km | log1p_num_cities_50km | log1p_sum_pop_50km | log1p_pop_gravity_50km | log1p_num_cities_100km | log1p_sum_pop_100km | log1p_pop_gravity_100km | dist_to_nearest_large_city | log1p_dist_to_nearest_large_city | log1p_pop_of_nearest_large_city | lat | lon | crimeindex_2020 | crimeindex_2023 | safetyindex_2020 | age_0_14 | age_15_64 | age_65_plus | population | density_per_km2 | gdp | gdp_per_capita | unemployment | homicide_rate | life_expectancy_male | life_expectancy_female | infant_mortality | urban_population_growth | tourists,all_features,rf,45.0,"{""bootstrap"": true, ""max_depth"": 16, ""max_features"": 0.9, ""min_samples_leaf"": 4, ""min_samples_split"": 7, ""n_estimators"": 200}",1.0,COMPLETE
43,8.754943147395577,2026-04-03 18:49:38.293556,2026-04-03 18:49:39.055862,0 days 00:00:00.762306,all_features,,,,,,,rf,True,20.0,0.9,4.0,8.0,200.0,6.379241427155748,0.6635270479307555,8.754943147395577,0.9921732259789374,dist_nearest_labeled_city | log1p_dist_nearest_labeled_city | crime_nearest_labeled_city | safety_nearest_labeled_city | same_country_as_nearest_labeled | avg_crime_k5 | avg_safety_k5 | avg_crime_k10 | avg_safety_k10 | wavg_crime_k5 | wavg_safety_k5 | log1p_num_labeled_within_50km | log1p_num_labeled_within_100km | log1p_num_labeled_within_250km | avg_crime_same_country_k5 | avg_safety_same_country_k5 | log1p_num_same_country_within_250km | log1p_num_cities_50km | log1p_sum_pop_50km | log1p_pop_gravity_50km | log1p_num_cities_100km | log1p_sum_pop_100km | log1p_pop_gravity_100km | dist_to_nearest_large_city | log1p_dist_to_nearest_large_city | log1p_pop_of_nearest_large_city | lat | lon | crimeindex_2020 | crimeindex_2023 | safetyindex_2020 | age_0_14 | age_15_64 | age_65_plus | population | density_per_km2 | gdp | gdp_per_capita | unemployment | homicide_rate | life_expectancy_male | life_expectancy_female | infant_mortality | urban_population_growth | tourists,all_features,rf,45.0,"{""bootstrap"": true, ""max_depth"": 20, ""max_features"": 0.9, ""min_samples_leaf"": 4, ""min_samples_split"": 8, ""n_estimators"": 200}",1.0,COMPLETE
44,11.84230331073146,2026-04-03 18:49:39.056482,2026-04-03 18:49:43.733730,0 days 00:00:04.677248,all_features,tanh,1.0090519786202995e-05,256.0,"(128, 64, 32)",0.0010896416501515046,3.467069049117493e-05,mlp,,,,,,,,,,,,,,,,,PRUNED
45,8.75494314739558,2026-04-03 18:49:43.734417,2026-04-03 18:49:44.519914,0 days 00:00:00.785497,all_features,,,,,,,rf,True,20.0,0.9,4.0,8.0,200.0,6.3792414271557485,0.6635270479307556,8.75494314739558,0.9921732259789376,dist_nearest_labeled_city | log1p_dist_nearest_labeled_city | crime_nearest_labeled_city | safety_nearest_labeled_city | same_country_as_nearest_labeled | avg_crime_k5 | avg_safety_k5 | avg_crime_k10 | avg_safety_k10 | wavg_crime_k5 | wavg_safety_k5 | log1p_num_labeled_within_50km | log1p_num_labeled_within_100km | log1p_num_labeled_within_250km | avg_crime_same_country_k5 | avg_safety_same_country_k5 | log1p_num_same_country_within_250km | log1p_num_cities_50km | log1p_sum_pop_50km | log1p_pop_gravity_50km | log1p_num_cities_100km | log1p_sum_pop_100km | log1p_pop_gravity_100km | dist_to_nearest_large_city | log1p_dist_to_nearest_large_city | log1p_pop_of_nearest_large_city | lat | lon | crimeindex_2020 | crimeindex_2023 | safetyindex_2020 | age_0_14 | age_15_64 | age_65_plus | population | density_per_km2 | gdp | gdp_per_capita | unemployment | homicide_rate | life_expectancy_male | life_expectancy_female | infant_mortality | urban_population_growth | tourists,all_features,rf,45.0,"{""bootstrap"": true, ""max_depth"": 20, ""max_features"": 0.9, ""min_samples_leaf"": 4, ""min_samples_split"": 8, ""n_estimators"": 200}",1.0,COMPLETE
46,10.363939725255864,2026-04-03 18:49:44.520586,2026-04-03 18:49:44.857716,0 days 00:00:00.337130,all_features,,,,,,,rf,False,20.0,0.9,4.0,8.0,200.0,,,,,,,,,,,PRUNED
47,8.72233899987842,2026-04-03 18:49:44.858426,2026-04-03 18:49:45.576047,0 days 00:00:00.717621,all_features,,,,,,,rf,True,20.0,0.7,3.0,9.0,200.0,6.354827798757959,0.6661671524939023,8.72233899987842,1.0123519122301605,dist_nearest_labeled_city | log1p_dist_nearest_labeled_city | crime_nearest_labeled_city | safety_nearest_labeled_city | same_country_as_nearest_labeled | avg_crime_k5 | avg_safety_k5 | avg_crime_k10 | avg_safety_k10 | wavg_crime_k5 | wavg_safety_k5 | log1p_num_labeled_within_50km | log1p_num_labeled_within_100km | log1p_num_labeled_within_250km | avg_crime_same_country_k5 | avg_safety_same_country_k5 | log1p_num_same_country_within_250km | log1p_num_cities_50km | log1p_sum_pop_50km | log1p_pop_gravity_50km | log1p_num_cities_100km | log1p_sum_pop_100km | log1p_pop_gravity_100km | dist_to_nearest_large_city | log1p_dist_to_nearest_large_city | log1p_pop_of_nearest_large_city | lat | lon | crimeindex_2020 | crimeindex_2023 | safetyindex_2020 | age_0_14 | age_15_64 | age_65_plus | population | density_per_km2 | gdp | gdp_per_capita | unemployment | homicide_rate | life_expectancy_male | life_expectancy_female | infant_mortality | urban_population_growth | tourists,all_features,rf,45.0,"{""bootstrap"": true, ""max_depth"": 20, ""max_features"": 0.7, ""min_samples_leaf"": 3, ""min_samples_split"": 9, ""n_estimators"": 200}",1.0,COMPLETE
48,12.817357117827068,2026-04-03 18:49:45.576669,2026-04-03 18:49:46.392270,0 days 00:00:00.815601,geo_only,tanh,0.0007094009170148475,128.0,"(256,)",0.0003915113594313497,0.0009990245283919192,mlp,,,,,,,,,,,,,,,,,PRUNED
49,8.72233899987842,2026-04-03 18:49:46.392893,2026-04-03 18:49:47.087361,0 days 00:00:00.694468,all_features,,,,,,,rf,True,20.0,0.7,3.0,9.0,200.0,6.35482779875796,0.6661671524939023,8.72233899987842,1.0123519122301596,dist_nearest_labeled_city | log1p_dist_nearest_labeled_city | crime_nearest_labeled_city | safety_nearest_labeled_city | same_country_as_nearest_labeled | avg_crime_k5 | avg_safety_k5 | avg_crime_k10 | avg_safety_k10 | wavg_crime_k5 | wavg_safety_k5 | log1p_num_labeled_within_50km | log1p_num_labeled_within_100km | log1p_num_labeled_within_250km | avg_crime_same_country_k5 | avg_safety_same_country_k5 | log1p_num_same_country_within_250km | log1p_num_cities_50km | log1p_sum_pop_50km | log1p_pop_gravity_50km | log1p_num_cities_100km | log1p_sum_pop_100km | log1p_pop_gravity_100km | dist_to_nearest_large_city | log1p_dist_to_nearest_large_city | log1p_pop_of_nearest_large_city | lat | lon | crimeindex_2020 | crimeindex_2023 | safetyindex_2020 | age_0_14 | age_15_64 | age_65_plus | population | density_per_km2 | gdp | gdp_per_capita | unemployment | homicide_rate | life_expectancy_male | life_expectancy_female | infant_mortality | urban_population_growth | tourists,all_features,rf,45.0,"{""bootstrap"": true, ""max_depth"": 20, ""max_features"": 0.7, ""min_samples_leaf"": 3, ""min_samples_split"": 9, ""n_estimators"": 200}",1.0,COMPLETE
50,8.709878164070952,2026-04-03 18:49:47.088047,2026-04-03 18:49:48.141092,0 days 00:00:01.053045,all_features,,,,,,,rf,True,20.0,0.7,3.0,9.0,300.0,6.346887646771371,0.6671705430432292,8.709878164070952,1.00875807881509,dist_nearest_labeled_city | log1p_dist_nearest_labeled_city | crime_nearest_labeled_city | safety_nearest_labeled_city | same_country_as_nearest_labeled | avg_crime_k5 | avg_safety_k5 | avg_crime_k10 | avg_safety_k10 | wavg_crime_k5 | wavg_safety_k5 | log1p_num_labeled_within_50km | log1p_num_labeled_within_100km | log1p_num_labeled_within_250km | avg_crime_same_country_k5 | avg_safety_same_country_k5 | log1p_num_same_country_within_250km | log1p_num_cities_50km | log1p_sum_pop_50km | log1p_pop_gravity_50km | log1p_num_cities_100km | log1p_sum_pop_100km | log1p_pop_gravity_100km | dist_to_nearest_large_city | log1p_dist_to_nearest_large_city | log1p_pop_of_nearest_large_city | lat | lon | crimeindex_2020 | crimeindex_2023 | safetyindex_2020 | age_0_14 | age_15_64 | age_65_plus | population | density_per_km2 | gdp | gdp_per_capita | unemployment | homicide_rate | life_expectancy_male | life_expectancy_female | infant_mortality | urban_population_growth | tourists,all_features,rf,45.0,"{""bootstrap"": true, ""max_depth"": 20, ""max_features"": 0.7, ""min_samples_leaf"": 3, ""min_samples_split"": 9, ""n_estimators"": 300}",1.0,COMPLETE
51,8.709878164070954,2026-04-03 18:49:48.141721,2026-04-03 18:49:49.202945,0 days 00:00:01.061224,all_features,,,,,,,rf,True,20.0,0.7,3.0,9.0,300.0,6.346887646771371,0.6671705430432292,8.709878164070954,1.0087580788150894,dist_nearest_labeled_city | log1p_dist_nearest_labeled_city | crime_nearest_labeled_city | safety_nearest_labeled_city | same_country_as_nearest_labeled | avg_crime_k5 | avg_safety_k5 | avg_crime_k10 | avg_safety_k10 | wavg_crime_k5 | wavg_safety_k5 | log1p_num_labeled_within_50km | log1p_num_labeled_within_100km | log1p_num_labeled_within_250km | avg_crime_same_country_k5 | avg_safety_same_country_k5 | log1p_num_same_country_within_250km | log1p_num_cities_50km | log1p_sum_pop_50km | log1p_pop_gravity_50km | log1p_num_cities_100km | log1p_sum_pop_100km | log1p_pop_gravity_100km | dist_to_nearest_large_city | log1p_dist_to_nearest_large_city | log1p_pop_of_nearest_large_city | lat | lon | crimeindex_2020 | crimeindex_2023 | safetyindex_2020 | age_0_14 | age_15_64 | age_65_plus | population | density_per_km2 | gdp | gdp_per_capita | unemployment | homicide_rate | life_expectancy_male | life_expectancy_female | infant_mortality | urban_population_growth | tourists,all_features,rf,45.0,"{""bootstrap"": true, ""max_depth"": 20, ""max_features"": 0.7, ""min_samples_leaf"": 3, ""min_samples_split"": 9, ""n_estimators"": 300}",1.0,COMPLETE
52,8.709878164070954,2026-04-03 18:49:49.203560,2026-04-03 18:49:50.255284,0 days 00:00:01.051724,all_features,,,,,,,rf,True,20.0,0.7,3.0,9.0,300.0,6.346887646771371,0.6671705430432292,8.709878164070954,1.0087580788150907,dist_nearest_labeled_city | log1p_dist_nearest_labeled_city | crime_nearest_labeled_city | safety_nearest_labeled_city | same_country_as_nearest_labeled | avg_crime_k5 | avg_safety_k5 | avg_crime_k10 | avg_safety_k10 | wavg_crime_k5 | wavg_safety_k5 | log1p_num_labeled_within_50km | log1p_num_labeled_within_100km | log1p_num_labeled_within_250km | avg_crime_same_country_k5 | avg_safety_same_country_k5 | log1p_num_same_country_within_250km | log1p_num_cities_50km | log1p_sum_pop_50km | log1p_pop_gravity_50km | log1p_num_cities_100km | log1p_sum_pop_100km | log1p_pop_gravity_100km | dist_to_nearest_large_city | log1p_dist_to_nearest_large_city | log1p_pop_of_nearest_large_city | lat | lon | crimeindex_2020 | crimeindex_2023 | safetyindex_2020 | age_0_14 | age_15_64 | age_65_plus | population | density_per_km2 | gdp | gdp_per_capita | unemployment | homicide_rate | life_expectancy_male | life_expectancy_female | infant_mortality | urban_population_growth | tourists,all_features,rf,45.0,"{""bootstrap"": true, ""max_depth"": 20, ""max_features"": 0.7, ""min_samples_leaf"": 3, ""min_samples_split"": 9, ""n_estimators"": 300}",1.0,COMPLETE
53,10.316651125235037,2026-04-03 18:49:50.255935,2026-04-03 18:49:50.616704,0 days 00:00:00.360769,geo_macro,,,,,,,rf,True,20.0,0.7,3.0,9.0,300.0,,,,,,,,,,,PRUNED
54,8.709878164070952,2026-04-03 18:49:50.617335,2026-04-03 18:49:51.671659,0 days 00:00:01.054324,all_features,,,,,,,rf,True,20.0,0.7,3.0,9.0,300.0,6.346887646771371,0.6671705430432292,8.709878164070952,1.0087580788150905,dist_nearest_labeled_city | log1p_dist_nearest_labeled_city | crime_nearest_labeled_city | safety_nearest_labeled_city | same_country_as_nearest_labeled | avg_crime_k5 | avg_safety_k5 | avg_crime_k10 | avg_safety_k10 | wavg_crime_k5 | wavg_safety_k5 | log1p_num_labeled_within_50km | log1p_num_labeled_within_100km | log1p_num_labeled_within_250km | avg_crime_same_country_k5 | avg_safety_same_country_k5 | log1p_num_same_country_within_250km | log1p_num_cities_50km | log1p_sum_pop_50km | log1p_pop_gravity_50km | log1p_num_cities_100km | log1p_sum_pop_100km | log1p_pop_gravity_100km | dist_to_nearest_large_city | log1p_dist_to_nearest_large_city | log1p_pop_of_nearest_large_city | lat | lon | crimeindex_2020 | crimeindex_2023 | safetyindex_2020 | age_0_14 | age_15_64 | age_65_plus | population | density_per_km2 | gdp | gdp_per_capita | unemployment | homicide_rate | life_expectancy_male | life_expectancy_female | infant_mortality | urban_population_growth | tourists,all_features,rf,45.0,"{""bootstrap"": true, ""max_depth"": 20, ""max_features"": 0.7, ""min_samples_leaf"": 3, ""min_samples_split"": 9, ""n_estimators"": 300}",1.0,COMPLETE
