number,value,datetime_start,datetime_complete,duration,params_feature_set_name,params_mlp_activation,params_mlp_alpha,params_mlp_batch_size,params_mlp_hidden_layer_sizes,params_mlp_learning_rate_init,params_mlp_tol,params_model_family,params_rf_bootstrap,params_rf_max_depth,params_rf_max_features,params_rf_min_samples_leaf,params_rf_min_samples_split,params_rf_n_estimators,user_attrs_cv_mae_mean,user_attrs_cv_r2_mean,user_attrs_cv_rmse_mean,user_attrs_cv_rmse_std,user_attrs_feature_list,user_attrs_feature_set_name,user_attrs_model_family,user_attrs_n_features,user_attrs_params_json,user_attrs_uses_current_city_crime_signal,state
93,8.701508553346557,2026-04-03 18:50:40.400137,2026-04-03 18:50:43.085958,0 days 00:00:02.685821,all_features,,,,,,,rf,True,20.0,0.7,2.0,9.0,800.0,6.3492179803400655,0.6674855361689328,8.701508553346557,0.9747788528472714,dist_nearest_labeled_city | log1p_dist_nearest_labeled_city | crime_nearest_labeled_city | safety_nearest_labeled_city | same_country_as_nearest_labeled | avg_crime_k5 | avg_safety_k5 | avg_crime_k10 | avg_safety_k10 | wavg_crime_k5 | wavg_safety_k5 | log1p_num_labeled_within_50km | log1p_num_labeled_within_100km | log1p_num_labeled_within_250km | avg_crime_same_country_k5 | avg_safety_same_country_k5 | log1p_num_same_country_within_250km | log1p_num_cities_50km | log1p_sum_pop_50km | log1p_pop_gravity_50km | log1p_num_cities_100km | log1p_sum_pop_100km | log1p_pop_gravity_100km | dist_to_nearest_large_city | log1p_dist_to_nearest_large_city | log1p_pop_of_nearest_large_city | lat | lon | crimeindex_2020 | crimeindex_2023 | safetyindex_2020 | age_0_14 | age_15_64 | age_65_plus | population | density_per_km2 | gdp | gdp_per_capita | unemployment | homicide_rate | life_expectancy_male | life_expectancy_female | infant_mortality | urban_population_growth | tourists,all_features,rf,45.0,"{""bootstrap"": true, ""max_depth"": 20, ""max_features"": 0.7, ""min_samples_leaf"": 2, ""min_samples_split"": 9, ""n_estimators"": 800}",1.0,COMPLETE
94,8.696219951763288,2026-04-03 18:50:43.086605,2026-04-03 18:50:45.781053,0 days 00:00:02.694448,all_features,,,,,,,rf,True,20.0,0.7,2.0,8.0,800.0,6.331366905963527,0.6678309739875044,8.696219951763288,0.9668114609972442,dist_nearest_labeled_city | log1p_dist_nearest_labeled_city | crime_nearest_labeled_city | safety_nearest_labeled_city | same_country_as_nearest_labeled | avg_crime_k5 | avg_safety_k5 | avg_crime_k10 | avg_safety_k10 | wavg_crime_k5 | wavg_safety_k5 | log1p_num_labeled_within_50km | log1p_num_labeled_within_100km | log1p_num_labeled_within_250km | avg_crime_same_country_k5 | avg_safety_same_country_k5 | log1p_num_same_country_within_250km | log1p_num_cities_50km | log1p_sum_pop_50km | log1p_pop_gravity_50km | log1p_num_cities_100km | log1p_sum_pop_100km | log1p_pop_gravity_100km | dist_to_nearest_large_city | log1p_dist_to_nearest_large_city | log1p_pop_of_nearest_large_city | lat | lon | crimeindex_2020 | crimeindex_2023 | safetyindex_2020 | age_0_14 | age_15_64 | age_65_plus | population | density_per_km2 | gdp | gdp_per_capita | unemployment | homicide_rate | life_expectancy_male | life_expectancy_female | infant_mortality | urban_population_growth | tourists,all_features,rf,45.0,"{""bootstrap"": true, ""max_depth"": 20, ""max_features"": 0.7, ""min_samples_leaf"": 2, ""min_samples_split"": 8, ""n_estimators"": 800}",1.0,COMPLETE
95,8.69621995176329,2026-04-03 18:50:45.781706,2026-04-03 18:50:48.475338,0 days 00:00:02.693632,all_features,,,,,,,rf,True,20.0,0.7,2.0,8.0,800.0,6.331366905963527,0.6678309739875041,8.69621995176329,0.9668114609972454,dist_nearest_labeled_city | log1p_dist_nearest_labeled_city | crime_nearest_labeled_city | safety_nearest_labeled_city | same_country_as_nearest_labeled | avg_crime_k5 | avg_safety_k5 | avg_crime_k10 | avg_safety_k10 | wavg_crime_k5 | wavg_safety_k5 | log1p_num_labeled_within_50km | log1p_num_labeled_within_100km | log1p_num_labeled_within_250km | avg_crime_same_country_k5 | avg_safety_same_country_k5 | log1p_num_same_country_within_250km | log1p_num_cities_50km | log1p_sum_pop_50km | log1p_pop_gravity_50km | log1p_num_cities_100km | log1p_sum_pop_100km | log1p_pop_gravity_100km | dist_to_nearest_large_city | log1p_dist_to_nearest_large_city | log1p_pop_of_nearest_large_city | lat | lon | crimeindex_2020 | crimeindex_2023 | safetyindex_2020 | age_0_14 | age_15_64 | age_65_plus | population | density_per_km2 | gdp | gdp_per_capita | unemployment | homicide_rate | life_expectancy_male | life_expectancy_female | infant_mortality | urban_population_growth | tourists,all_features,rf,45.0,"{""bootstrap"": true, ""max_depth"": 20, ""max_features"": 0.7, ""min_samples_leaf"": 2, ""min_samples_split"": 8, ""n_estimators"": 800}",1.0,COMPLETE
96,8.94252362394094,2026-04-03 18:50:48.475989,2026-04-03 18:50:50.652602,0 days 00:00:02.176613,all_features,,,,,,,rf,True,12.0,sqrt,2.0,6.0,800.0,6.696762961960582,0.6505341810665043,8.94252362394094,1.1190217080388574,dist_nearest_labeled_city | log1p_dist_nearest_labeled_city | crime_nearest_labeled_city | safety_nearest_labeled_city | same_country_as_nearest_labeled | avg_crime_k5 | avg_safety_k5 | avg_crime_k10 | avg_safety_k10 | wavg_crime_k5 | wavg_safety_k5 | log1p_num_labeled_within_50km | log1p_num_labeled_within_100km | log1p_num_labeled_within_250km | avg_crime_same_country_k5 | avg_safety_same_country_k5 | log1p_num_same_country_within_250km | log1p_num_cities_50km | log1p_sum_pop_50km | log1p_pop_gravity_50km | log1p_num_cities_100km | log1p_sum_pop_100km | log1p_pop_gravity_100km | dist_to_nearest_large_city | log1p_dist_to_nearest_large_city | log1p_pop_of_nearest_large_city | lat | lon | crimeindex_2020 | crimeindex_2023 | safetyindex_2020 | age_0_14 | age_15_64 | age_65_plus | population | density_per_km2 | gdp | gdp_per_capita | unemployment | homicide_rate | life_expectancy_male | life_expectancy_female | infant_mortality | urban_population_growth | tourists,all_features,rf,45.0,"{""bootstrap"": true, ""max_depth"": 12, ""max_features"": ""sqrt"", ""min_samples_leaf"": 2, ""min_samples_split"": 6, ""n_estimators"": 800}",1.0,COMPLETE
97,8.696219951763288,2026-04-03 18:50:50.653262,2026-04-03 18:50:53.344260,0 days 00:00:02.690998,all_features,,,,,,,rf,True,20.0,0.7,2.0,8.0,800.0,6.331366905963527,0.6678309739875042,8.696219951763288,0.9668114609972449,dist_nearest_labeled_city | log1p_dist_nearest_labeled_city | crime_nearest_labeled_city | safety_nearest_labeled_city | same_country_as_nearest_labeled | avg_crime_k5 | avg_safety_k5 | avg_crime_k10 | avg_safety_k10 | wavg_crime_k5 | wavg_safety_k5 | log1p_num_labeled_within_50km | log1p_num_labeled_within_100km | log1p_num_labeled_within_250km | avg_crime_same_country_k5 | avg_safety_same_country_k5 | log1p_num_same_country_within_250km | log1p_num_cities_50km | log1p_sum_pop_50km | log1p_pop_gravity_50km | log1p_num_cities_100km | log1p_sum_pop_100km | log1p_pop_gravity_100km | dist_to_nearest_large_city | log1p_dist_to_nearest_large_city | log1p_pop_of_nearest_large_city | lat | lon | crimeindex_2020 | crimeindex_2023 | safetyindex_2020 | age_0_14 | age_15_64 | age_65_plus | population | density_per_km2 | gdp | gdp_per_capita | unemployment | homicide_rate | life_expectancy_male | life_expectancy_female | infant_mortality | urban_population_growth | tourists,all_features,rf,45.0,"{""bootstrap"": true, ""max_depth"": 20, ""max_features"": 0.7, ""min_samples_leaf"": 2, ""min_samples_split"": 8, ""n_estimators"": 800}",1.0,COMPLETE
98,8.693093502186876,2026-04-03 18:50:53.344923,2026-04-03 18:50:56.080880,0 days 00:00:02.735957,all_features,,,,,,,rf,True,20.0,0.7,2.0,7.0,800.0,6.327394662716436,0.668171350530627,8.693093502186876,0.9702413277959295,dist_nearest_labeled_city | log1p_dist_nearest_labeled_city | crime_nearest_labeled_city | safety_nearest_labeled_city | same_country_as_nearest_labeled | avg_crime_k5 | avg_safety_k5 | avg_crime_k10 | avg_safety_k10 | wavg_crime_k5 | wavg_safety_k5 | log1p_num_labeled_within_50km | log1p_num_labeled_within_100km | log1p_num_labeled_within_250km | avg_crime_same_country_k5 | avg_safety_same_country_k5 | log1p_num_same_country_within_250km | log1p_num_cities_50km | log1p_sum_pop_50km | log1p_pop_gravity_50km | log1p_num_cities_100km | log1p_sum_pop_100km | log1p_pop_gravity_100km | dist_to_nearest_large_city | log1p_dist_to_nearest_large_city | log1p_pop_of_nearest_large_city | lat | lon | crimeindex_2020 | crimeindex_2023 | safetyindex_2020 | age_0_14 | age_15_64 | age_65_plus | population | density_per_km2 | gdp | gdp_per_capita | unemployment | homicide_rate | life_expectancy_male | life_expectancy_female | infant_mortality | urban_population_growth | tourists,all_features,rf,45.0,"{""bootstrap"": true, ""max_depth"": 20, ""max_features"": 0.7, ""min_samples_leaf"": 2, ""min_samples_split"": 7, ""n_estimators"": 800}",1.0,COMPLETE
99,8.693093502186874,2026-04-03 18:50:56.081519,2026-04-03 18:50:58.799438,0 days 00:00:02.717919,all_features,,,,,,,rf,True,20.0,0.7,2.0,7.0,800.0,6.327394662716436,0.6681713505306272,8.693093502186874,0.9702413277959298,dist_nearest_labeled_city | log1p_dist_nearest_labeled_city | crime_nearest_labeled_city | safety_nearest_labeled_city | same_country_as_nearest_labeled | avg_crime_k5 | avg_safety_k5 | avg_crime_k10 | avg_safety_k10 | wavg_crime_k5 | wavg_safety_k5 | log1p_num_labeled_within_50km | log1p_num_labeled_within_100km | log1p_num_labeled_within_250km | avg_crime_same_country_k5 | avg_safety_same_country_k5 | log1p_num_same_country_within_250km | log1p_num_cities_50km | log1p_sum_pop_50km | log1p_pop_gravity_50km | log1p_num_cities_100km | log1p_sum_pop_100km | log1p_pop_gravity_100km | dist_to_nearest_large_city | log1p_dist_to_nearest_large_city | log1p_pop_of_nearest_large_city | lat | lon | crimeindex_2020 | crimeindex_2023 | safetyindex_2020 | age_0_14 | age_15_64 | age_65_plus | population | density_per_km2 | gdp | gdp_per_capita | unemployment | homicide_rate | life_expectancy_male | life_expectancy_female | infant_mortality | urban_population_growth | tourists,all_features,rf,45.0,"{""bootstrap"": true, ""max_depth"": 20, ""max_features"": 0.7, ""min_samples_leaf"": 2, ""min_samples_split"": 7, ""n_estimators"": 800}",1.0,COMPLETE
100,10.166692548587395,2026-04-03 18:50:58.800062,2026-04-03 18:50:59.669724,0 days 00:00:00.869662,geo_macro,,,,,,,rf,True,20.0,0.7,2.0,7.0,800.0,,,,,,,,,,,PRUNED
101,8.693093502186874,2026-04-03 18:50:59.670341,2026-04-03 18:51:02.482069,0 days 00:00:02.811728,all_features,,,,,,,rf,True,20.0,0.7,2.0,7.0,800.0,6.3273946627164355,0.6681713505306272,8.693093502186874,0.9702413277959298,dist_nearest_labeled_city | log1p_dist_nearest_labeled_city | crime_nearest_labeled_city | safety_nearest_labeled_city | same_country_as_nearest_labeled | avg_crime_k5 | avg_safety_k5 | avg_crime_k10 | avg_safety_k10 | wavg_crime_k5 | wavg_safety_k5 | log1p_num_labeled_within_50km | log1p_num_labeled_within_100km | log1p_num_labeled_within_250km | avg_crime_same_country_k5 | avg_safety_same_country_k5 | log1p_num_same_country_within_250km | log1p_num_cities_50km | log1p_sum_pop_50km | log1p_pop_gravity_50km | log1p_num_cities_100km | log1p_sum_pop_100km | log1p_pop_gravity_100km | dist_to_nearest_large_city | log1p_dist_to_nearest_large_city | log1p_pop_of_nearest_large_city | lat | lon | crimeindex_2020 | crimeindex_2023 | safetyindex_2020 | age_0_14 | age_15_64 | age_65_plus | population | density_per_km2 | gdp | gdp_per_capita | unemployment | homicide_rate | life_expectancy_male | life_expectancy_female | infant_mortality | urban_population_growth | tourists,all_features,rf,45.0,"{""bootstrap"": true, ""max_depth"": 20, ""max_features"": 0.7, ""min_samples_leaf"": 2, ""min_samples_split"": 7, ""n_estimators"": 800}",1.0,COMPLETE
102,8.690728008626518,2026-04-03 18:51:02.482732,2026-04-03 18:51:05.519796,0 days 00:00:03.037064,all_features,,,,,,,rf,True,20.0,0.7,2.0,7.0,900.0,6.328150403106757,0.6683453222393038,8.690728008626518,0.96424955815413,dist_nearest_labeled_city | log1p_dist_nearest_labeled_city | crime_nearest_labeled_city | safety_nearest_labeled_city | same_country_as_nearest_labeled | avg_crime_k5 | avg_safety_k5 | avg_crime_k10 | avg_safety_k10 | wavg_crime_k5 | wavg_safety_k5 | log1p_num_labeled_within_50km | log1p_num_labeled_within_100km | log1p_num_labeled_within_250km | avg_crime_same_country_k5 | avg_safety_same_country_k5 | log1p_num_same_country_within_250km | log1p_num_cities_50km | log1p_sum_pop_50km | log1p_pop_gravity_50km | log1p_num_cities_100km | log1p_sum_pop_100km | log1p_pop_gravity_100km | dist_to_nearest_large_city | log1p_dist_to_nearest_large_city | log1p_pop_of_nearest_large_city | lat | lon | crimeindex_2020 | crimeindex_2023 | safetyindex_2020 | age_0_14 | age_15_64 | age_65_plus | population | density_per_km2 | gdp | gdp_per_capita | unemployment | homicide_rate | life_expectancy_male | life_expectancy_female | infant_mortality | urban_population_growth | tourists,all_features,rf,45.0,"{""bootstrap"": true, ""max_depth"": 20, ""max_features"": 0.7, ""min_samples_leaf"": 2, ""min_samples_split"": 7, ""n_estimators"": 900}",1.0,COMPLETE
103,8.690728008626518,2026-04-03 18:51:05.520423,2026-04-03 18:51:08.548633,0 days 00:00:03.028210,all_features,,,,,,,rf,True,20.0,0.7,2.0,7.0,900.0,6.328150403106756,0.6683453222393038,8.690728008626518,0.9642495581541304,dist_nearest_labeled_city | log1p_dist_nearest_labeled_city | crime_nearest_labeled_city | safety_nearest_labeled_city | same_country_as_nearest_labeled | avg_crime_k5 | avg_safety_k5 | avg_crime_k10 | avg_safety_k10 | wavg_crime_k5 | wavg_safety_k5 | log1p_num_labeled_within_50km | log1p_num_labeled_within_100km | log1p_num_labeled_within_250km | avg_crime_same_country_k5 | avg_safety_same_country_k5 | log1p_num_same_country_within_250km | log1p_num_cities_50km | log1p_sum_pop_50km | log1p_pop_gravity_50km | log1p_num_cities_100km | log1p_sum_pop_100km | log1p_pop_gravity_100km | dist_to_nearest_large_city | log1p_dist_to_nearest_large_city | log1p_pop_of_nearest_large_city | lat | lon | crimeindex_2020 | crimeindex_2023 | safetyindex_2020 | age_0_14 | age_15_64 | age_65_plus | population | density_per_km2 | gdp | gdp_per_capita | unemployment | homicide_rate | life_expectancy_male | life_expectancy_female | infant_mortality | urban_population_growth | tourists,all_features,rf,45.0,"{""bootstrap"": true, ""max_depth"": 20, ""max_features"": 0.7, ""min_samples_leaf"": 2, ""min_samples_split"": 7, ""n_estimators"": 900}",1.0,COMPLETE
104,8.690728008626518,2026-04-03 18:51:08.549258,2026-04-03 18:51:11.586138,0 days 00:00:03.036880,all_features,,,,,,,rf,True,30.0,0.7,2.0,7.0,900.0,6.328150403106757,0.6683453222393039,8.690728008626518,0.9642495581541303,dist_nearest_labeled_city | log1p_dist_nearest_labeled_city | crime_nearest_labeled_city | safety_nearest_labeled_city | same_country_as_nearest_labeled | avg_crime_k5 | avg_safety_k5 | avg_crime_k10 | avg_safety_k10 | wavg_crime_k5 | wavg_safety_k5 | log1p_num_labeled_within_50km | log1p_num_labeled_within_100km | log1p_num_labeled_within_250km | avg_crime_same_country_k5 | avg_safety_same_country_k5 | log1p_num_same_country_within_250km | log1p_num_cities_50km | log1p_sum_pop_50km | log1p_pop_gravity_50km | log1p_num_cities_100km | log1p_sum_pop_100km | log1p_pop_gravity_100km | dist_to_nearest_large_city | log1p_dist_to_nearest_large_city | log1p_pop_of_nearest_large_city | lat | lon | crimeindex_2020 | crimeindex_2023 | safetyindex_2020 | age_0_14 | age_15_64 | age_65_plus | population | density_per_km2 | gdp | gdp_per_capita | unemployment | homicide_rate | life_expectancy_male | life_expectancy_female | infant_mortality | urban_population_growth | tourists,all_features,rf,45.0,"{""bootstrap"": true, ""max_depth"": 30, ""max_features"": 0.7, ""min_samples_leaf"": 2, ""min_samples_split"": 7, ""n_estimators"": 900}",1.0,COMPLETE
105,8.690728008626518,2026-04-03 18:51:11.586780,2026-04-03 18:51:14.690716,0 days 00:00:03.103936,all_features,,,,,,,rf,True,30.0,0.7,2.0,7.0,900.0,6.328150403106757,0.6683453222393037,8.690728008626518,0.9642495581541296,dist_nearest_labeled_city | log1p_dist_nearest_labeled_city | crime_nearest_labeled_city | safety_nearest_labeled_city | same_country_as_nearest_labeled | avg_crime_k5 | avg_safety_k5 | avg_crime_k10 | avg_safety_k10 | wavg_crime_k5 | wavg_safety_k5 | log1p_num_labeled_within_50km | log1p_num_labeled_within_100km | log1p_num_labeled_within_250km | avg_crime_same_country_k5 | avg_safety_same_country_k5 | log1p_num_same_country_within_250km | log1p_num_cities_50km | log1p_sum_pop_50km | log1p_pop_gravity_50km | log1p_num_cities_100km | log1p_sum_pop_100km | log1p_pop_gravity_100km | dist_to_nearest_large_city | log1p_dist_to_nearest_large_city | log1p_pop_of_nearest_large_city | lat | lon | crimeindex_2020 | crimeindex_2023 | safetyindex_2020 | age_0_14 | age_15_64 | age_65_plus | population | density_per_km2 | gdp | gdp_per_capita | unemployment | homicide_rate | life_expectancy_male | life_expectancy_female | infant_mortality | urban_population_growth | tourists,all_features,rf,45.0,"{""bootstrap"": true, ""max_depth"": 30, ""max_features"": 0.7, ""min_samples_leaf"": 2, ""min_samples_split"": 7, ""n_estimators"": 900}",1.0,COMPLETE
106,9.016960862133498,2026-04-03 18:51:14.691377,2026-04-03 18:51:17.124905,0 days 00:00:02.433528,all_features,,,,,,,rf,True,30.0,log2,2.0,7.0,900.0,6.797152408817236,0.6448479522037518,9.016960862133498,1.13113714221084,dist_nearest_labeled_city | log1p_dist_nearest_labeled_city | crime_nearest_labeled_city | safety_nearest_labeled_city | same_country_as_nearest_labeled | avg_crime_k5 | avg_safety_k5 | avg_crime_k10 | avg_safety_k10 | wavg_crime_k5 | wavg_safety_k5 | log1p_num_labeled_within_50km | log1p_num_labeled_within_100km | log1p_num_labeled_within_250km | avg_crime_same_country_k5 | avg_safety_same_country_k5 | log1p_num_same_country_within_250km | log1p_num_cities_50km | log1p_sum_pop_50km | log1p_pop_gravity_50km | log1p_num_cities_100km | log1p_sum_pop_100km | log1p_pop_gravity_100km | dist_to_nearest_large_city | log1p_dist_to_nearest_large_city | log1p_pop_of_nearest_large_city | lat | lon | crimeindex_2020 | crimeindex_2023 | safetyindex_2020 | age_0_14 | age_15_64 | age_65_plus | population | density_per_km2 | gdp | gdp_per_capita | unemployment | homicide_rate | life_expectancy_male | life_expectancy_female | infant_mortality | urban_population_growth | tourists,all_features,rf,45.0,"{""bootstrap"": true, ""max_depth"": 30, ""max_features"": ""log2"", ""min_samples_leaf"": 2, ""min_samples_split"": 7, ""n_estimators"": 900}",1.0,COMPLETE
107,8.689161433397608,2026-04-03 18:51:17.125553,2026-04-03 18:51:20.210112,0 days 00:00:03.084559,all_features,,,,,,,rf,True,30.0,0.7,1.0,7.0,900.0,6.354321139240532,0.6683625968321222,8.689161433397608,0.9451780422814647,dist_nearest_labeled_city | log1p_dist_nearest_labeled_city | crime_nearest_labeled_city | safety_nearest_labeled_city | same_country_as_nearest_labeled | avg_crime_k5 | avg_safety_k5 | avg_crime_k10 | avg_safety_k10 | wavg_crime_k5 | wavg_safety_k5 | log1p_num_labeled_within_50km | log1p_num_labeled_within_100km | log1p_num_labeled_within_250km | avg_crime_same_country_k5 | avg_safety_same_country_k5 | log1p_num_same_country_within_250km | log1p_num_cities_50km | log1p_sum_pop_50km | log1p_pop_gravity_50km | log1p_num_cities_100km | log1p_sum_pop_100km | log1p_pop_gravity_100km | dist_to_nearest_large_city | log1p_dist_to_nearest_large_city | log1p_pop_of_nearest_large_city | lat | lon | crimeindex_2020 | crimeindex_2023 | safetyindex_2020 | age_0_14 | age_15_64 | age_65_plus | population | density_per_km2 | gdp | gdp_per_capita | unemployment | homicide_rate | life_expectancy_male | life_expectancy_female | infant_mortality | urban_population_growth | tourists,all_features,rf,45.0,"{""bootstrap"": true, ""max_depth"": 30, ""max_features"": 0.7, ""min_samples_leaf"": 1, ""min_samples_split"": 7, ""n_estimators"": 900}",1.0,COMPLETE
108,10.405171753176484,2026-04-03 18:51:20.210738,2026-04-03 18:51:22.888993,0 days 00:00:02.678255,geo_knn_density,,,,,,,rf,True,30.0,0.7,1.0,7.0,900.0,7.794905130317778,0.5262050808860964,10.405171753176484,1.4613052374011255,lat | lon | dist_nearest_labeled_city | log1p_dist_nearest_labeled_city | crime_nearest_labeled_city | safety_nearest_labeled_city | same_country_as_nearest_labeled | avg_crime_k5 | avg_safety_k5 | avg_crime_k10 | avg_safety_k10 | wavg_crime_k5 | wavg_safety_k5 | log1p_num_labeled_within_50km | log1p_num_labeled_within_100km | log1p_num_labeled_within_250km | avg_crime_same_country_k5 | avg_safety_same_country_k5 | log1p_num_same_country_within_250km | log1p_num_cities_50km | log1p_sum_pop_50km | log1p_pop_gravity_50km | log1p_num_cities_100km | log1p_sum_pop_100km | log1p_pop_gravity_100km | dist_to_nearest_large_city | log1p_dist_to_nearest_large_city | log1p_pop_of_nearest_large_city,geo_knn_density,rf,28.0,"{""bootstrap"": true, ""max_depth"": 30, ""max_features"": 0.7, ""min_samples_leaf"": 1, ""min_samples_split"": 7, ""n_estimators"": 900}",0.0,COMPLETE
109,10.17556088997566,2026-04-03 18:51:22.889639,2026-04-03 18:51:25.179081,0 days 00:00:02.289442,all_features,tanh,0.0004346858732353964,128.0,"(128,)",0.0003714283036720344,0.000455185673827432,mlp,,,,,,,,,,,,,,,,,PRUNED
