number,value,datetime_start,datetime_complete,duration,params_feature_set_name,params_mlp_activation,params_mlp_alpha,params_mlp_batch_size,params_mlp_hidden_layer_sizes,params_mlp_learning_rate_init,params_mlp_tol,params_model_family,params_rf_bootstrap,params_rf_max_depth,params_rf_max_features,params_rf_min_samples_leaf,params_rf_min_samples_split,params_rf_n_estimators,user_attrs_cv_mae_mean,user_attrs_cv_r2_mean,user_attrs_cv_rmse_mean,user_attrs_cv_rmse_std,user_attrs_feature_list,user_attrs_feature_set_name,user_attrs_model_family,user_attrs_n_features,user_attrs_params_json,user_attrs_uses_current_city_crime_signal,state
19,9.327322277505042,2026-04-03 18:49:01.034160,2026-04-03 18:49:02.145290,0 days 00:00:01.111130,all_no_current_crime,,,,,,,rf,True,30.0,log2,3.0,2.0,400.0,7.08131179255812,0.6207131471925581,9.327322277505042,1.179679130045474,dist_nearest_labeled_city | log1p_dist_nearest_labeled_city | crime_nearest_labeled_city | safety_nearest_labeled_city | same_country_as_nearest_labeled | avg_crime_k5 | avg_safety_k5 | avg_crime_k10 | avg_safety_k10 | wavg_crime_k5 | wavg_safety_k5 | log1p_num_labeled_within_50km | log1p_num_labeled_within_100km | log1p_num_labeled_within_250km | avg_crime_same_country_k5 | avg_safety_same_country_k5 | log1p_num_same_country_within_250km | log1p_num_cities_50km | log1p_sum_pop_50km | log1p_pop_gravity_50km | log1p_num_cities_100km | log1p_sum_pop_100km | log1p_pop_gravity_100km | dist_to_nearest_large_city | log1p_dist_to_nearest_large_city | log1p_pop_of_nearest_large_city | lat | lon | crimeindex_2020 | safetyindex_2020 | age_0_14 | age_15_64 | age_65_plus | population | density_per_km2 | gdp | gdp_per_capita | unemployment | homicide_rate | life_expectancy_male | life_expectancy_female | infant_mortality | urban_population_growth | tourists,all_no_current_crime,rf,44.0,"{""bootstrap"": true, ""max_depth"": 30, ""max_features"": ""log2"", ""min_samples_leaf"": 3, ""min_samples_split"": 2, ""n_estimators"": 400}",0.0,COMPLETE
20,9.364767532156739,2026-04-03 18:49:02.145935,2026-04-03 18:49:03.278428,0 days 00:00:01.132493,all_no_current_crime,,,,,,,rf,True,30.0,sqrt,4.0,4.0,400.0,7.125467951043386,0.6171817484659469,9.364767532156739,1.187637651531092,dist_nearest_labeled_city | log1p_dist_nearest_labeled_city | crime_nearest_labeled_city | safety_nearest_labeled_city | same_country_as_nearest_labeled | avg_crime_k5 | avg_safety_k5 | avg_crime_k10 | avg_safety_k10 | wavg_crime_k5 | wavg_safety_k5 | log1p_num_labeled_within_50km | log1p_num_labeled_within_100km | log1p_num_labeled_within_250km | avg_crime_same_country_k5 | avg_safety_same_country_k5 | log1p_num_same_country_within_250km | log1p_num_cities_50km | log1p_sum_pop_50km | log1p_pop_gravity_50km | log1p_num_cities_100km | log1p_sum_pop_100km | log1p_pop_gravity_100km | dist_to_nearest_large_city | log1p_dist_to_nearest_large_city | log1p_pop_of_nearest_large_city | lat | lon | crimeindex_2020 | safetyindex_2020 | age_0_14 | age_15_64 | age_65_plus | population | density_per_km2 | gdp | gdp_per_capita | unemployment | homicide_rate | life_expectancy_male | life_expectancy_female | infant_mortality | urban_population_growth | tourists,all_no_current_crime,rf,44.0,"{""bootstrap"": true, ""max_depth"": 30, ""max_features"": ""sqrt"", ""min_samples_leaf"": 4, ""min_samples_split"": 4, ""n_estimators"": 400}",0.0,COMPLETE
21,9.08062029171414,2026-04-03 18:49:03.279044,2026-04-03 18:49:04.703778,0 days 00:00:01.424734,all_no_current_crime,,,,,,,rf,True,30.0,sqrt,1.0,3.0,500.0,6.781521667386995,0.6396069487501866,9.08062029171414,1.101389982293973,dist_nearest_labeled_city | log1p_dist_nearest_labeled_city | crime_nearest_labeled_city | safety_nearest_labeled_city | same_country_as_nearest_labeled | avg_crime_k5 | avg_safety_k5 | avg_crime_k10 | avg_safety_k10 | wavg_crime_k5 | wavg_safety_k5 | log1p_num_labeled_within_50km | log1p_num_labeled_within_100km | log1p_num_labeled_within_250km | avg_crime_same_country_k5 | avg_safety_same_country_k5 | log1p_num_same_country_within_250km | log1p_num_cities_50km | log1p_sum_pop_50km | log1p_pop_gravity_50km | log1p_num_cities_100km | log1p_sum_pop_100km | log1p_pop_gravity_100km | dist_to_nearest_large_city | log1p_dist_to_nearest_large_city | log1p_pop_of_nearest_large_city | lat | lon | crimeindex_2020 | safetyindex_2020 | age_0_14 | age_15_64 | age_65_plus | population | density_per_km2 | gdp | gdp_per_capita | unemployment | homicide_rate | life_expectancy_male | life_expectancy_female | infant_mortality | urban_population_growth | tourists,all_no_current_crime,rf,44.0,"{""bootstrap"": true, ""max_depth"": 30, ""max_features"": ""sqrt"", ""min_samples_leaf"": 1, ""min_samples_split"": 3, ""n_estimators"": 500}",0.0,COMPLETE
22,9.190472456230822,2026-04-03 18:49:04.704431,2026-04-03 18:49:06.100498,0 days 00:00:01.396067,all_no_current_crime,,,,,,,rf,True,30.0,sqrt,2.0,3.0,500.0,6.896349903444317,0.6314657695082815,9.190472456230822,1.1490565487426043,dist_nearest_labeled_city | log1p_dist_nearest_labeled_city | crime_nearest_labeled_city | safety_nearest_labeled_city | same_country_as_nearest_labeled | avg_crime_k5 | avg_safety_k5 | avg_crime_k10 | avg_safety_k10 | wavg_crime_k5 | wavg_safety_k5 | log1p_num_labeled_within_50km | log1p_num_labeled_within_100km | log1p_num_labeled_within_250km | avg_crime_same_country_k5 | avg_safety_same_country_k5 | log1p_num_same_country_within_250km | log1p_num_cities_50km | log1p_sum_pop_50km | log1p_pop_gravity_50km | log1p_num_cities_100km | log1p_sum_pop_100km | log1p_pop_gravity_100km | dist_to_nearest_large_city | log1p_dist_to_nearest_large_city | log1p_pop_of_nearest_large_city | lat | lon | crimeindex_2020 | safetyindex_2020 | age_0_14 | age_15_64 | age_65_plus | population | density_per_km2 | gdp | gdp_per_capita | unemployment | homicide_rate | life_expectancy_male | life_expectancy_female | infant_mortality | urban_population_growth | tourists,all_no_current_crime,rf,44.0,"{""bootstrap"": true, ""max_depth"": 30, ""max_features"": ""sqrt"", ""min_samples_leaf"": 2, ""min_samples_split"": 3, ""n_estimators"": 500}",0.0,COMPLETE
23,9.190472456230822,2026-04-03 18:49:06.101170,2026-04-03 18:49:07.505485,0 days 00:00:01.404315,all_no_current_crime,,,,,,,rf,True,30.0,sqrt,2.0,3.0,500.0,6.896349903444316,0.6314657695082815,9.190472456230822,1.1490565487426045,dist_nearest_labeled_city | log1p_dist_nearest_labeled_city | crime_nearest_labeled_city | safety_nearest_labeled_city | same_country_as_nearest_labeled | avg_crime_k5 | avg_safety_k5 | avg_crime_k10 | avg_safety_k10 | wavg_crime_k5 | wavg_safety_k5 | log1p_num_labeled_within_50km | log1p_num_labeled_within_100km | log1p_num_labeled_within_250km | avg_crime_same_country_k5 | avg_safety_same_country_k5 | log1p_num_same_country_within_250km | log1p_num_cities_50km | log1p_sum_pop_50km | log1p_pop_gravity_50km | log1p_num_cities_100km | log1p_sum_pop_100km | log1p_pop_gravity_100km | dist_to_nearest_large_city | log1p_dist_to_nearest_large_city | log1p_pop_of_nearest_large_city | lat | lon | crimeindex_2020 | safetyindex_2020 | age_0_14 | age_15_64 | age_65_plus | population | density_per_km2 | gdp | gdp_per_capita | unemployment | homicide_rate | life_expectancy_male | life_expectancy_female | infant_mortality | urban_population_growth | tourists,all_no_current_crime,rf,44.0,"{""bootstrap"": true, ""max_depth"": 30, ""max_features"": ""sqrt"", ""min_samples_leaf"": 2, ""min_samples_split"": 3, ""n_estimators"": 500}",0.0,COMPLETE
24,9.122732576485827,2026-04-03 18:49:07.506126,2026-04-03 18:49:09.161373,0 days 00:00:01.655247,all_no_current_crime,,,,,,,rf,True,30.0,sqrt,1.0,4.0,600.0,6.815376649952211,0.6367623473384685,9.122732576485827,1.1166019277227937,dist_nearest_labeled_city | log1p_dist_nearest_labeled_city | crime_nearest_labeled_city | safety_nearest_labeled_city | same_country_as_nearest_labeled | avg_crime_k5 | avg_safety_k5 | avg_crime_k10 | avg_safety_k10 | wavg_crime_k5 | wavg_safety_k5 | log1p_num_labeled_within_50km | log1p_num_labeled_within_100km | log1p_num_labeled_within_250km | avg_crime_same_country_k5 | avg_safety_same_country_k5 | log1p_num_same_country_within_250km | log1p_num_cities_50km | log1p_sum_pop_50km | log1p_pop_gravity_50km | log1p_num_cities_100km | log1p_sum_pop_100km | log1p_pop_gravity_100km | dist_to_nearest_large_city | log1p_dist_to_nearest_large_city | log1p_pop_of_nearest_large_city | lat | lon | crimeindex_2020 | safetyindex_2020 | age_0_14 | age_15_64 | age_65_plus | population | density_per_km2 | gdp | gdp_per_capita | unemployment | homicide_rate | life_expectancy_male | life_expectancy_female | infant_mortality | urban_population_growth | tourists,all_no_current_crime,rf,44.0,"{""bootstrap"": true, ""max_depth"": 30, ""max_features"": ""sqrt"", ""min_samples_leaf"": 1, ""min_samples_split"": 4, ""n_estimators"": 600}",0.0,COMPLETE
25,10.34088682785961,2026-04-03 18:49:09.162009,2026-04-03 18:49:10.344047,0 days 00:00:01.182038,geo_knn_density,,,,,,,rf,False,30.0,sqrt,1.0,5.0,600.0,7.691887303523036,0.5326573036618475,10.34088682785961,1.5059279735151885,lat | lon | dist_nearest_labeled_city | log1p_dist_nearest_labeled_city | crime_nearest_labeled_city | safety_nearest_labeled_city | same_country_as_nearest_labeled | avg_crime_k5 | avg_safety_k5 | avg_crime_k10 | avg_safety_k10 | wavg_crime_k5 | wavg_safety_k5 | log1p_num_labeled_within_50km | log1p_num_labeled_within_100km | log1p_num_labeled_within_250km | avg_crime_same_country_k5 | avg_safety_same_country_k5 | log1p_num_same_country_within_250km | log1p_num_cities_50km | log1p_sum_pop_50km | log1p_pop_gravity_50km | log1p_num_cities_100km | log1p_sum_pop_100km | log1p_pop_gravity_100km | dist_to_nearest_large_city | log1p_dist_to_nearest_large_city | log1p_pop_of_nearest_large_city,geo_knn_density,rf,28.0,"{""bootstrap"": false, ""max_depth"": 30, ""max_features"": ""sqrt"", ""min_samples_leaf"": 1, ""min_samples_split"": 5, ""n_estimators"": 600}",0.0,COMPLETE
26,10.620852098518572,2026-04-03 18:49:10.344673,2026-04-03 18:49:11.974508,0 days 00:00:01.629835,geo_macro,,,,,,,rf,True,12.0,0.7,1.0,3.0,600.0,8.341175871133306,0.5082650406356178,10.620852098518572,0.8664034156581559,lat | lon | gdp | gdp_per_capita | unemployment | homicide_rate | life_expectancy_male | life_expectancy_female | infant_mortality | urban_population_growth | tourists,geo_macro,rf,11.0,"{""bootstrap"": true, ""max_depth"": 12, ""max_features"": 0.7, ""min_samples_leaf"": 1, ""min_samples_split"": 3, ""n_estimators"": 600}",0.0,COMPLETE
27,8.897131437935858,2026-04-03 18:49:11.975144,2026-04-03 18:49:13.272714,0 days 00:00:01.297570,all_no_current_crime,,,,,,,rf,True,16.0,0.9,1.0,4.0,300.0,6.498942581944159,0.6543016865766431,8.897131437935858,0.9755681750279914,dist_nearest_labeled_city | log1p_dist_nearest_labeled_city | crime_nearest_labeled_city | safety_nearest_labeled_city | same_country_as_nearest_labeled | avg_crime_k5 | avg_safety_k5 | avg_crime_k10 | avg_safety_k10 | wavg_crime_k5 | wavg_safety_k5 | log1p_num_labeled_within_50km | log1p_num_labeled_within_100km | log1p_num_labeled_within_250km | avg_crime_same_country_k5 | avg_safety_same_country_k5 | log1p_num_same_country_within_250km | log1p_num_cities_50km | log1p_sum_pop_50km | log1p_pop_gravity_50km | log1p_num_cities_100km | log1p_sum_pop_100km | log1p_pop_gravity_100km | dist_to_nearest_large_city | log1p_dist_to_nearest_large_city | log1p_pop_of_nearest_large_city | lat | lon | crimeindex_2020 | safetyindex_2020 | age_0_14 | age_15_64 | age_65_plus | population | density_per_km2 | gdp | gdp_per_capita | unemployment | homicide_rate | life_expectancy_male | life_expectancy_female | infant_mortality | urban_population_growth | tourists,all_no_current_crime,rf,44.0,"{""bootstrap"": true, ""max_depth"": 16, ""max_features"": 0.9, ""min_samples_leaf"": 1, ""min_samples_split"": 4, ""n_estimators"": 300}",0.0,COMPLETE
28,8.914834833188436,2026-04-03 18:49:13.273447,2026-04-03 18:49:14.568426,0 days 00:00:01.294979,all_no_current_crime,,,,,,,rf,True,16.0,0.9,2.0,6.0,300.0,6.501035874530068,0.6529455976644998,8.914834833188436,0.9624222532933374,dist_nearest_labeled_city | log1p_dist_nearest_labeled_city | crime_nearest_labeled_city | safety_nearest_labeled_city | same_country_as_nearest_labeled | avg_crime_k5 | avg_safety_k5 | avg_crime_k10 | avg_safety_k10 | wavg_crime_k5 | wavg_safety_k5 | log1p_num_labeled_within_50km | log1p_num_labeled_within_100km | log1p_num_labeled_within_250km | avg_crime_same_country_k5 | avg_safety_same_country_k5 | log1p_num_same_country_within_250km | log1p_num_cities_50km | log1p_sum_pop_50km | log1p_pop_gravity_50km | log1p_num_cities_100km | log1p_sum_pop_100km | log1p_pop_gravity_100km | dist_to_nearest_large_city | log1p_dist_to_nearest_large_city | log1p_pop_of_nearest_large_city | lat | lon | crimeindex_2020 | safetyindex_2020 | age_0_14 | age_15_64 | age_65_plus | population | density_per_km2 | gdp | gdp_per_capita | unemployment | homicide_rate | life_expectancy_male | life_expectancy_female | infant_mortality | urban_population_growth | tourists,all_no_current_crime,rf,44.0,"{""bootstrap"": true, ""max_depth"": 16, ""max_features"": 0.9, ""min_samples_leaf"": 2, ""min_samples_split"": 6, ""n_estimators"": 300}",0.0,COMPLETE
29,10.651825086976393,2026-04-03 18:49:14.569072,2026-04-03 18:49:15.123825,0 days 00:00:00.554753,all_no_current_crime,,,,,,,rf,False,16.0,0.9,2.0,6.0,300.0,,,,,,,,,,,PRUNED
30,8.914834833188436,2026-04-03 18:49:15.124477,2026-04-03 18:49:16.351753,0 days 00:00:01.227276,all_no_current_crime,,,,,,,rf,True,16.0,0.9,2.0,6.0,300.0,6.501035874530068,0.6529455976644998,8.914834833188436,0.9624222532933371,dist_nearest_labeled_city | log1p_dist_nearest_labeled_city | crime_nearest_labeled_city | safety_nearest_labeled_city | same_country_as_nearest_labeled | avg_crime_k5 | avg_safety_k5 | avg_crime_k10 | avg_safety_k10 | wavg_crime_k5 | wavg_safety_k5 | log1p_num_labeled_within_50km | log1p_num_labeled_within_100km | log1p_num_labeled_within_250km | avg_crime_same_country_k5 | avg_safety_same_country_k5 | log1p_num_same_country_within_250km | log1p_num_cities_50km | log1p_sum_pop_50km | log1p_pop_gravity_50km | log1p_num_cities_100km | log1p_sum_pop_100km | log1p_pop_gravity_100km | dist_to_nearest_large_city | log1p_dist_to_nearest_large_city | log1p_pop_of_nearest_large_city | lat | lon | crimeindex_2020 | safetyindex_2020 | age_0_14 | age_15_64 | age_65_plus | population | density_per_km2 | gdp | gdp_per_capita | unemployment | homicide_rate | life_expectancy_male | life_expectancy_female | infant_mortality | urban_population_growth | tourists,all_no_current_crime,rf,44.0,"{""bootstrap"": true, ""max_depth"": 16, ""max_features"": 0.9, ""min_samples_leaf"": 2, ""min_samples_split"": 6, ""n_estimators"": 300}",0.0,COMPLETE
31,8.914834833188436,2026-04-03 18:49:16.352408,2026-04-03 18:49:17.569953,0 days 00:00:01.217545,all_no_current_crime,,,,,,,rf,True,16.0,0.9,2.0,6.0,300.0,6.50103587453007,0.6529455976644997,8.914834833188436,0.9624222532933374,dist_nearest_labeled_city | log1p_dist_nearest_labeled_city | crime_nearest_labeled_city | safety_nearest_labeled_city | same_country_as_nearest_labeled | avg_crime_k5 | avg_safety_k5 | avg_crime_k10 | avg_safety_k10 | wavg_crime_k5 | wavg_safety_k5 | log1p_num_labeled_within_50km | log1p_num_labeled_within_100km | log1p_num_labeled_within_250km | avg_crime_same_country_k5 | avg_safety_same_country_k5 | log1p_num_same_country_within_250km | log1p_num_cities_50km | log1p_sum_pop_50km | log1p_pop_gravity_50km | log1p_num_cities_100km | log1p_sum_pop_100km | log1p_pop_gravity_100km | dist_to_nearest_large_city | log1p_dist_to_nearest_large_city | log1p_pop_of_nearest_large_city | lat | lon | crimeindex_2020 | safetyindex_2020 | age_0_14 | age_15_64 | age_65_plus | population | density_per_km2 | gdp | gdp_per_capita | unemployment | homicide_rate | life_expectancy_male | life_expectancy_female | infant_mortality | urban_population_growth | tourists,all_no_current_crime,rf,44.0,"{""bootstrap"": true, ""max_depth"": 16, ""max_features"": 0.9, ""min_samples_leaf"": 2, ""min_samples_split"": 6, ""n_estimators"": 300}",0.0,COMPLETE
32,8.914834833188438,2026-04-03 18:49:17.570606,2026-04-03 18:49:18.799085,0 days 00:00:01.228479,all_no_current_crime,,,,,,,rf,True,16.0,0.9,2.0,6.0,300.0,6.501035874530068,0.6529455976644997,8.914834833188438,0.9624222532933367,dist_nearest_labeled_city | log1p_dist_nearest_labeled_city | crime_nearest_labeled_city | safety_nearest_labeled_city | same_country_as_nearest_labeled | avg_crime_k5 | avg_safety_k5 | avg_crime_k10 | avg_safety_k10 | wavg_crime_k5 | wavg_safety_k5 | log1p_num_labeled_within_50km | log1p_num_labeled_within_100km | log1p_num_labeled_within_250km | avg_crime_same_country_k5 | avg_safety_same_country_k5 | log1p_num_same_country_within_250km | log1p_num_cities_50km | log1p_sum_pop_50km | log1p_pop_gravity_50km | log1p_num_cities_100km | log1p_sum_pop_100km | log1p_pop_gravity_100km | dist_to_nearest_large_city | log1p_dist_to_nearest_large_city | log1p_pop_of_nearest_large_city | lat | lon | crimeindex_2020 | safetyindex_2020 | age_0_14 | age_15_64 | age_65_plus | population | density_per_km2 | gdp | gdp_per_capita | unemployment | homicide_rate | life_expectancy_male | life_expectancy_female | infant_mortality | urban_population_growth | tourists,all_no_current_crime,rf,44.0,"{""bootstrap"": true, ""max_depth"": 16, ""max_features"": 0.9, ""min_samples_leaf"": 2, ""min_samples_split"": 6, ""n_estimators"": 300}",0.0,COMPLETE
33,8.675555536397706,2026-04-03 18:49:18.799755,2026-04-03 18:49:20.009536,0 days 00:00:01.209781,all_features,,,,,,,rf,True,16.0,0.9,3.0,6.0,300.0,6.300594574561853,0.6696352671851309,8.675555536397706,1.021618279776665,dist_nearest_labeled_city | log1p_dist_nearest_labeled_city | crime_nearest_labeled_city | safety_nearest_labeled_city | same_country_as_nearest_labeled | avg_crime_k5 | avg_safety_k5 | avg_crime_k10 | avg_safety_k10 | wavg_crime_k5 | wavg_safety_k5 | log1p_num_labeled_within_50km | log1p_num_labeled_within_100km | log1p_num_labeled_within_250km | avg_crime_same_country_k5 | avg_safety_same_country_k5 | log1p_num_same_country_within_250km | log1p_num_cities_50km | log1p_sum_pop_50km | log1p_pop_gravity_50km | log1p_num_cities_100km | log1p_sum_pop_100km | log1p_pop_gravity_100km | dist_to_nearest_large_city | log1p_dist_to_nearest_large_city | log1p_pop_of_nearest_large_city | lat | lon | crimeindex_2020 | crimeindex_2023 | safetyindex_2020 | age_0_14 | age_15_64 | age_65_plus | population | density_per_km2 | gdp | gdp_per_capita | unemployment | homicide_rate | life_expectancy_male | life_expectancy_female | infant_mortality | urban_population_growth | tourists,all_features,rf,45.0,"{""bootstrap"": true, ""max_depth"": 16, ""max_features"": 0.9, ""min_samples_leaf"": 3, ""min_samples_split"": 6, ""n_estimators"": 300}",1.0,COMPLETE
34,8.754943147395577,2026-04-03 18:49:20.010185,2026-04-03 18:49:20.788358,0 days 00:00:00.778173,all_features,,,,,,,rf,True,16.0,0.9,4.0,7.0,200.0,6.379241427155748,0.6635270479307556,8.754943147395577,0.9921732259789366,dist_nearest_labeled_city | log1p_dist_nearest_labeled_city | crime_nearest_labeled_city | safety_nearest_labeled_city | same_country_as_nearest_labeled | avg_crime_k5 | avg_safety_k5 | avg_crime_k10 | avg_safety_k10 | wavg_crime_k5 | wavg_safety_k5 | log1p_num_labeled_within_50km | log1p_num_labeled_within_100km | log1p_num_labeled_within_250km | avg_crime_same_country_k5 | avg_safety_same_country_k5 | log1p_num_same_country_within_250km | log1p_num_cities_50km | log1p_sum_pop_50km | log1p_pop_gravity_50km | log1p_num_cities_100km | log1p_sum_pop_100km | log1p_pop_gravity_100km | dist_to_nearest_large_city | log1p_dist_to_nearest_large_city | log1p_pop_of_nearest_large_city | lat | lon | crimeindex_2020 | crimeindex_2023 | safetyindex_2020 | age_0_14 | age_15_64 | age_65_plus | population | density_per_km2 | gdp | gdp_per_capita | unemployment | homicide_rate | life_expectancy_male | life_expectancy_female | infant_mortality | urban_population_growth | tourists,all_features,rf,45.0,"{""bootstrap"": true, ""max_depth"": 16, ""max_features"": 0.9, ""min_samples_leaf"": 4, ""min_samples_split"": 7, ""n_estimators"": 200}",1.0,COMPLETE
35,8.754943147395577,2026-04-03 18:49:20.789026,2026-04-03 18:49:21.572406,0 days 00:00:00.783380,all_features,,,,,,,rf,True,16.0,0.9,4.0,7.0,200.0,6.379241427155748,0.6635270479307556,8.754943147395577,0.9921732259789376,dist_nearest_labeled_city | log1p_dist_nearest_labeled_city | crime_nearest_labeled_city | safety_nearest_labeled_city | same_country_as_nearest_labeled | avg_crime_k5 | avg_safety_k5 | avg_crime_k10 | avg_safety_k10 | wavg_crime_k5 | wavg_safety_k5 | log1p_num_labeled_within_50km | log1p_num_labeled_within_100km | log1p_num_labeled_within_250km | avg_crime_same_country_k5 | avg_safety_same_country_k5 | log1p_num_same_country_within_250km | log1p_num_cities_50km | log1p_sum_pop_50km | log1p_pop_gravity_50km | log1p_num_cities_100km | log1p_sum_pop_100km | log1p_pop_gravity_100km | dist_to_nearest_large_city | log1p_dist_to_nearest_large_city | log1p_pop_of_nearest_large_city | lat | lon | crimeindex_2020 | crimeindex_2023 | safetyindex_2020 | age_0_14 | age_15_64 | age_65_plus | population | density_per_km2 | gdp | gdp_per_capita | unemployment | homicide_rate | life_expectancy_male | life_expectancy_female | infant_mortality | urban_population_growth | tourists,all_features,rf,45.0,"{""bootstrap"": true, ""max_depth"": 16, ""max_features"": 0.9, ""min_samples_leaf"": 4, ""min_samples_split"": 7, ""n_estimators"": 200}",1.0,COMPLETE
