number,value,datetime_start,datetime_complete,duration,params_feature_set_name,params_mlp_activation,params_mlp_alpha,params_mlp_batch_size,params_mlp_hidden_layer_sizes,params_mlp_learning_rate_init,params_mlp_tol,params_model_family,params_rf_bootstrap,params_rf_max_depth,params_rf_max_features,params_rf_min_samples_leaf,params_rf_min_samples_split,params_rf_n_estimators,user_attrs_cv_mae_mean,user_attrs_cv_r2_mean,user_attrs_cv_rmse_mean,user_attrs_cv_rmse_std,user_attrs_feature_list,user_attrs_feature_set_name,user_attrs_model_family,user_attrs_n_features,user_attrs_params_json,user_attrs_uses_current_city_crime_signal,state
73,8.734775301354725,2026-04-03 18:50:12.449322,2026-04-03 18:50:13.537167,0 days 00:00:01.087845,all_features,,,,,,,rf,True,20.0,0.7,3.0,8.0,300.0,6.3465968590248805,0.6650224757012755,8.734775301354725,1.0191180393321808,dist_nearest_labeled_city | log1p_dist_nearest_labeled_city | crime_nearest_labeled_city | safety_nearest_labeled_city | same_country_as_nearest_labeled | avg_crime_k5 | avg_safety_k5 | avg_crime_k10 | avg_safety_k10 | wavg_crime_k5 | wavg_safety_k5 | log1p_num_labeled_within_50km | log1p_num_labeled_within_100km | log1p_num_labeled_within_250km | avg_crime_same_country_k5 | avg_safety_same_country_k5 | log1p_num_same_country_within_250km | log1p_num_cities_50km | log1p_sum_pop_50km | log1p_pop_gravity_50km | log1p_num_cities_100km | log1p_sum_pop_100km | log1p_pop_gravity_100km | dist_to_nearest_large_city | log1p_dist_to_nearest_large_city | log1p_pop_of_nearest_large_city | lat | lon | crimeindex_2020 | crimeindex_2023 | safetyindex_2020 | age_0_14 | age_15_64 | age_65_plus | population | density_per_km2 | gdp | gdp_per_capita | unemployment | homicide_rate | life_expectancy_male | life_expectancy_female | infant_mortality | urban_population_growth | tourists,all_features,rf,45.0,"{""bootstrap"": true, ""max_depth"": 20, ""max_features"": 0.7, ""min_samples_leaf"": 3, ""min_samples_split"": 8, ""n_estimators"": 300}",1.0,COMPLETE
74,9.069038747746777,2026-04-03 18:50:13.537800,2026-04-03 18:50:14.545187,0 days 00:00:01.007387,all_features,,,,,,,rf,True,20.0,log2,3.0,10.0,300.0,6.909290432679278,0.6407354073262356,9.069038747746777,1.1518660385477466,dist_nearest_labeled_city | log1p_dist_nearest_labeled_city | crime_nearest_labeled_city | safety_nearest_labeled_city | same_country_as_nearest_labeled | avg_crime_k5 | avg_safety_k5 | avg_crime_k10 | avg_safety_k10 | wavg_crime_k5 | wavg_safety_k5 | log1p_num_labeled_within_50km | log1p_num_labeled_within_100km | log1p_num_labeled_within_250km | avg_crime_same_country_k5 | avg_safety_same_country_k5 | log1p_num_same_country_within_250km | log1p_num_cities_50km | log1p_sum_pop_50km | log1p_pop_gravity_50km | log1p_num_cities_100km | log1p_sum_pop_100km | log1p_pop_gravity_100km | dist_to_nearest_large_city | log1p_dist_to_nearest_large_city | log1p_pop_of_nearest_large_city | lat | lon | crimeindex_2020 | crimeindex_2023 | safetyindex_2020 | age_0_14 | age_15_64 | age_65_plus | population | density_per_km2 | gdp | gdp_per_capita | unemployment | homicide_rate | life_expectancy_male | life_expectancy_female | infant_mortality | urban_population_growth | tourists,all_features,rf,45.0,"{""bootstrap"": true, ""max_depth"": 20, ""max_features"": ""log2"", ""min_samples_leaf"": 3, ""min_samples_split"": 10, ""n_estimators"": 300}",1.0,COMPLETE
75,8.726251022691274,2026-04-03 18:50:14.545993,2026-04-03 18:50:15.895682,0 days 00:00:01.349689,all_features,,,,,,,rf,True,,0.7,3.0,9.0,400.0,6.3569523226216,0.6657329125650648,8.726251022691274,0.998617470622105,dist_nearest_labeled_city | log1p_dist_nearest_labeled_city | crime_nearest_labeled_city | safety_nearest_labeled_city | same_country_as_nearest_labeled | avg_crime_k5 | avg_safety_k5 | avg_crime_k10 | avg_safety_k10 | wavg_crime_k5 | wavg_safety_k5 | log1p_num_labeled_within_50km | log1p_num_labeled_within_100km | log1p_num_labeled_within_250km | avg_crime_same_country_k5 | avg_safety_same_country_k5 | log1p_num_same_country_within_250km | log1p_num_cities_50km | log1p_sum_pop_50km | log1p_pop_gravity_50km | log1p_num_cities_100km | log1p_sum_pop_100km | log1p_pop_gravity_100km | dist_to_nearest_large_city | log1p_dist_to_nearest_large_city | log1p_pop_of_nearest_large_city | lat | lon | crimeindex_2020 | crimeindex_2023 | safetyindex_2020 | age_0_14 | age_15_64 | age_65_plus | population | density_per_km2 | gdp | gdp_per_capita | unemployment | homicide_rate | life_expectancy_male | life_expectancy_female | infant_mortality | urban_population_growth | tourists,all_features,rf,45.0,"{""bootstrap"": true, ""max_depth"": null, ""max_features"": 0.7, ""min_samples_leaf"": 3, ""min_samples_split"": 9, ""n_estimators"": 400}",1.0,COMPLETE
76,8.663329717176007,2026-04-03 18:50:15.896318,2026-04-03 18:50:16.982689,0 days 00:00:01.086371,all_features,,,,,,,rf,True,12.0,0.7,2.0,9.0,300.0,6.331225080416519,0.6705349428977552,8.663329717176007,0.9851702106568361,dist_nearest_labeled_city | log1p_dist_nearest_labeled_city | crime_nearest_labeled_city | safety_nearest_labeled_city | same_country_as_nearest_labeled | avg_crime_k5 | avg_safety_k5 | avg_crime_k10 | avg_safety_k10 | wavg_crime_k5 | wavg_safety_k5 | log1p_num_labeled_within_50km | log1p_num_labeled_within_100km | log1p_num_labeled_within_250km | avg_crime_same_country_k5 | avg_safety_same_country_k5 | log1p_num_same_country_within_250km | log1p_num_cities_50km | log1p_sum_pop_50km | log1p_pop_gravity_50km | log1p_num_cities_100km | log1p_sum_pop_100km | log1p_pop_gravity_100km | dist_to_nearest_large_city | log1p_dist_to_nearest_large_city | log1p_pop_of_nearest_large_city | lat | lon | crimeindex_2020 | crimeindex_2023 | safetyindex_2020 | age_0_14 | age_15_64 | age_65_plus | population | density_per_km2 | gdp | gdp_per_capita | unemployment | homicide_rate | life_expectancy_male | life_expectancy_female | infant_mortality | urban_population_growth | tourists,all_features,rf,45.0,"{""bootstrap"": true, ""max_depth"": 12, ""max_features"": 0.7, ""min_samples_leaf"": 2, ""min_samples_split"": 9, ""n_estimators"": 300}",1.0,COMPLETE
77,10.01739524212585,2026-04-03 18:50:16.983295,2026-04-03 18:50:17.457069,0 days 00:00:00.473774,all_features,,,,,,,rf,False,12.0,0.7,2.0,8.0,300.0,,,,,,,,,,,PRUNED
78,9.945602230296874,2026-04-03 18:50:17.457683,2026-04-03 18:50:17.997109,0 days 00:00:00.539426,all_features,relu,0.0015231589318089015,64.0,"(128, 64, 32)",0.0013603002820363839,2.961868872285509e-05,mlp,,,,,,,,,,,,,,,,,PRUNED
79,10.288960194986174,2026-04-03 18:50:17.997764,2026-04-03 18:50:18.453556,0 days 00:00:00.455792,geo_macro,,,,,,,rf,True,12.0,0.7,2.0,10.0,400.0,,,,,,,,,,,PRUNED
80,10.401066344468628,2026-04-03 18:50:18.454159,2026-04-03 18:50:19.412715,0 days 00:00:00.958556,geo_knn_density,,,,,,,rf,True,12.0,0.7,2.0,5.0,300.0,7.787466425616098,0.526985975164194,10.401066344468628,1.4266977791886843,lat | lon | dist_nearest_labeled_city | log1p_dist_nearest_labeled_city | crime_nearest_labeled_city | safety_nearest_labeled_city | same_country_as_nearest_labeled | avg_crime_k5 | avg_safety_k5 | avg_crime_k10 | avg_safety_k10 | wavg_crime_k5 | wavg_safety_k5 | log1p_num_labeled_within_50km | log1p_num_labeled_within_100km | log1p_num_labeled_within_250km | avg_crime_same_country_k5 | avg_safety_same_country_k5 | log1p_num_same_country_within_250km | log1p_num_cities_50km | log1p_sum_pop_50km | log1p_pop_gravity_50km | log1p_num_cities_100km | log1p_sum_pop_100km | log1p_pop_gravity_100km | dist_to_nearest_large_city | log1p_dist_to_nearest_large_city | log1p_pop_of_nearest_large_city,geo_knn_density,rf,28.0,"{""bootstrap"": true, ""max_depth"": 12, ""max_features"": 0.7, ""min_samples_leaf"": 2, ""min_samples_split"": 5, ""n_estimators"": 300}",0.0,COMPLETE
81,8.709878164070952,2026-04-03 18:50:19.413435,2026-04-03 18:50:20.477042,0 days 00:00:01.063607,all_features,,,,,,,rf,True,20.0,0.7,3.0,9.0,300.0,6.346887646771371,0.6671705430432292,8.709878164070952,1.0087580788150894,dist_nearest_labeled_city | log1p_dist_nearest_labeled_city | crime_nearest_labeled_city | safety_nearest_labeled_city | same_country_as_nearest_labeled | avg_crime_k5 | avg_safety_k5 | avg_crime_k10 | avg_safety_k10 | wavg_crime_k5 | wavg_safety_k5 | log1p_num_labeled_within_50km | log1p_num_labeled_within_100km | log1p_num_labeled_within_250km | avg_crime_same_country_k5 | avg_safety_same_country_k5 | log1p_num_same_country_within_250km | log1p_num_cities_50km | log1p_sum_pop_50km | log1p_pop_gravity_50km | log1p_num_cities_100km | log1p_sum_pop_100km | log1p_pop_gravity_100km | dist_to_nearest_large_city | log1p_dist_to_nearest_large_city | log1p_pop_of_nearest_large_city | lat | lon | crimeindex_2020 | crimeindex_2023 | safetyindex_2020 | age_0_14 | age_15_64 | age_65_plus | population | density_per_km2 | gdp | gdp_per_capita | unemployment | homicide_rate | life_expectancy_male | life_expectancy_female | infant_mortality | urban_population_growth | tourists,all_features,rf,45.0,"{""bootstrap"": true, ""max_depth"": 20, ""max_features"": 0.7, ""min_samples_leaf"": 3, ""min_samples_split"": 9, ""n_estimators"": 300}",1.0,COMPLETE
82,8.709878164070954,2026-04-03 18:50:20.477685,2026-04-03 18:50:21.544296,0 days 00:00:01.066611,all_features,,,,,,,rf,True,20.0,0.7,3.0,9.0,300.0,6.346887646771371,0.6671705430432292,8.709878164070954,1.0087580788150907,dist_nearest_labeled_city | log1p_dist_nearest_labeled_city | crime_nearest_labeled_city | safety_nearest_labeled_city | same_country_as_nearest_labeled | avg_crime_k5 | avg_safety_k5 | avg_crime_k10 | avg_safety_k10 | wavg_crime_k5 | wavg_safety_k5 | log1p_num_labeled_within_50km | log1p_num_labeled_within_100km | log1p_num_labeled_within_250km | avg_crime_same_country_k5 | avg_safety_same_country_k5 | log1p_num_same_country_within_250km | log1p_num_cities_50km | log1p_sum_pop_50km | log1p_pop_gravity_50km | log1p_num_cities_100km | log1p_sum_pop_100km | log1p_pop_gravity_100km | dist_to_nearest_large_city | log1p_dist_to_nearest_large_city | log1p_pop_of_nearest_large_city | lat | lon | crimeindex_2020 | crimeindex_2023 | safetyindex_2020 | age_0_14 | age_15_64 | age_65_plus | population | density_per_km2 | gdp | gdp_per_capita | unemployment | homicide_rate | life_expectancy_male | life_expectancy_female | infant_mortality | urban_population_growth | tourists,all_features,rf,45.0,"{""bootstrap"": true, ""max_depth"": 20, ""max_features"": 0.7, ""min_samples_leaf"": 3, ""min_samples_split"": 9, ""n_estimators"": 300}",1.0,COMPLETE
83,8.745324143113399,2026-04-03 18:50:21.544931,2026-04-03 18:50:23.802678,0 days 00:00:02.257747,all_features,,,,,,,rf,True,12.0,0.7,3.0,9.0,700.0,6.360557975688415,0.6641883994472343,8.745324143113399,0.9954827900964408,dist_nearest_labeled_city | log1p_dist_nearest_labeled_city | crime_nearest_labeled_city | safety_nearest_labeled_city | same_country_as_nearest_labeled | avg_crime_k5 | avg_safety_k5 | avg_crime_k10 | avg_safety_k10 | wavg_crime_k5 | wavg_safety_k5 | log1p_num_labeled_within_50km | log1p_num_labeled_within_100km | log1p_num_labeled_within_250km | avg_crime_same_country_k5 | avg_safety_same_country_k5 | log1p_num_same_country_within_250km | log1p_num_cities_50km | log1p_sum_pop_50km | log1p_pop_gravity_50km | log1p_num_cities_100km | log1p_sum_pop_100km | log1p_pop_gravity_100km | dist_to_nearest_large_city | log1p_dist_to_nearest_large_city | log1p_pop_of_nearest_large_city | lat | lon | crimeindex_2020 | crimeindex_2023 | safetyindex_2020 | age_0_14 | age_15_64 | age_65_plus | population | density_per_km2 | gdp | gdp_per_capita | unemployment | homicide_rate | life_expectancy_male | life_expectancy_female | infant_mortality | urban_population_growth | tourists,all_features,rf,45.0,"{""bootstrap"": true, ""max_depth"": 12, ""max_features"": 0.7, ""min_samples_leaf"": 3, ""min_samples_split"": 9, ""n_estimators"": 700}",1.0,COMPLETE
84,8.709878164070952,2026-04-03 18:50:23.803333,2026-04-03 18:50:24.857492,0 days 00:00:01.054159,all_features,,,,,,,rf,True,20.0,0.7,3.0,9.0,300.0,6.34688764677137,0.6671705430432292,8.709878164070952,1.0087580788150903,dist_nearest_labeled_city | log1p_dist_nearest_labeled_city | crime_nearest_labeled_city | safety_nearest_labeled_city | same_country_as_nearest_labeled | avg_crime_k5 | avg_safety_k5 | avg_crime_k10 | avg_safety_k10 | wavg_crime_k5 | wavg_safety_k5 | log1p_num_labeled_within_50km | log1p_num_labeled_within_100km | log1p_num_labeled_within_250km | avg_crime_same_country_k5 | avg_safety_same_country_k5 | log1p_num_same_country_within_250km | log1p_num_cities_50km | log1p_sum_pop_50km | log1p_pop_gravity_50km | log1p_num_cities_100km | log1p_sum_pop_100km | log1p_pop_gravity_100km | dist_to_nearest_large_city | log1p_dist_to_nearest_large_city | log1p_pop_of_nearest_large_city | lat | lon | crimeindex_2020 | crimeindex_2023 | safetyindex_2020 | age_0_14 | age_15_64 | age_65_plus | population | density_per_km2 | gdp | gdp_per_capita | unemployment | homicide_rate | life_expectancy_male | life_expectancy_female | infant_mortality | urban_population_growth | tourists,all_features,rf,45.0,"{""bootstrap"": true, ""max_depth"": 20, ""max_features"": 0.7, ""min_samples_leaf"": 3, ""min_samples_split"": 9, ""n_estimators"": 300}",1.0,COMPLETE
85,9.12052817687372,2026-04-03 18:50:24.858106,2026-04-03 18:50:25.961210,0 days 00:00:01.103104,all_features,,,,,,,rf,True,8.0,log2,2.0,8.0,400.0,6.953123724683978,0.6368666604848687,9.12052817687372,1.1509005840397963,dist_nearest_labeled_city | log1p_dist_nearest_labeled_city | crime_nearest_labeled_city | safety_nearest_labeled_city | same_country_as_nearest_labeled | avg_crime_k5 | avg_safety_k5 | avg_crime_k10 | avg_safety_k10 | wavg_crime_k5 | wavg_safety_k5 | log1p_num_labeled_within_50km | log1p_num_labeled_within_100km | log1p_num_labeled_within_250km | avg_crime_same_country_k5 | avg_safety_same_country_k5 | log1p_num_same_country_within_250km | log1p_num_cities_50km | log1p_sum_pop_50km | log1p_pop_gravity_50km | log1p_num_cities_100km | log1p_sum_pop_100km | log1p_pop_gravity_100km | dist_to_nearest_large_city | log1p_dist_to_nearest_large_city | log1p_pop_of_nearest_large_city | lat | lon | crimeindex_2020 | crimeindex_2023 | safetyindex_2020 | age_0_14 | age_15_64 | age_65_plus | population | density_per_km2 | gdp | gdp_per_capita | unemployment | homicide_rate | life_expectancy_male | life_expectancy_female | infant_mortality | urban_population_growth | tourists,all_features,rf,45.0,"{""bootstrap"": true, ""max_depth"": 8, ""max_features"": ""log2"", ""min_samples_leaf"": 2, ""min_samples_split"": 8, ""n_estimators"": 400}",1.0,COMPLETE
86,8.709878164070952,2026-04-03 18:50:25.961870,2026-04-03 18:50:27.017225,0 days 00:00:01.055355,all_features,,,,,,,rf,True,20.0,0.7,3.0,9.0,300.0,6.346887646771372,0.6671705430432291,8.709878164070952,1.0087580788150898,dist_nearest_labeled_city | log1p_dist_nearest_labeled_city | crime_nearest_labeled_city | safety_nearest_labeled_city | same_country_as_nearest_labeled | avg_crime_k5 | avg_safety_k5 | avg_crime_k10 | avg_safety_k10 | wavg_crime_k5 | wavg_safety_k5 | log1p_num_labeled_within_50km | log1p_num_labeled_within_100km | log1p_num_labeled_within_250km | avg_crime_same_country_k5 | avg_safety_same_country_k5 | log1p_num_same_country_within_250km | log1p_num_cities_50km | log1p_sum_pop_50km | log1p_pop_gravity_50km | log1p_num_cities_100km | log1p_sum_pop_100km | log1p_pop_gravity_100km | dist_to_nearest_large_city | log1p_dist_to_nearest_large_city | log1p_pop_of_nearest_large_city | lat | lon | crimeindex_2020 | crimeindex_2023 | safetyindex_2020 | age_0_14 | age_15_64 | age_65_plus | population | density_per_km2 | gdp | gdp_per_capita | unemployment | homicide_rate | life_expectancy_male | life_expectancy_female | infant_mortality | urban_population_growth | tourists,all_features,rf,45.0,"{""bootstrap"": true, ""max_depth"": 20, ""max_features"": 0.7, ""min_samples_leaf"": 3, ""min_samples_split"": 9, ""n_estimators"": 300}",1.0,COMPLETE
87,8.758998011484712,2026-04-03 18:50:27.017842,2026-04-03 18:50:28.063362,0 days 00:00:01.045520,all_features,,,,,,,rf,True,20.0,0.7,3.0,10.0,300.0,6.381845320795988,0.6634182646949671,8.758998011484712,1.0101407610051225,dist_nearest_labeled_city | log1p_dist_nearest_labeled_city | crime_nearest_labeled_city | safety_nearest_labeled_city | same_country_as_nearest_labeled | avg_crime_k5 | avg_safety_k5 | avg_crime_k10 | avg_safety_k10 | wavg_crime_k5 | wavg_safety_k5 | log1p_num_labeled_within_50km | log1p_num_labeled_within_100km | log1p_num_labeled_within_250km | avg_crime_same_country_k5 | avg_safety_same_country_k5 | log1p_num_same_country_within_250km | log1p_num_cities_50km | log1p_sum_pop_50km | log1p_pop_gravity_50km | log1p_num_cities_100km | log1p_sum_pop_100km | log1p_pop_gravity_100km | dist_to_nearest_large_city | log1p_dist_to_nearest_large_city | log1p_pop_of_nearest_large_city | lat | lon | crimeindex_2020 | crimeindex_2023 | safetyindex_2020 | age_0_14 | age_15_64 | age_65_plus | population | density_per_km2 | gdp | gdp_per_capita | unemployment | homicide_rate | life_expectancy_male | life_expectancy_female | infant_mortality | urban_population_growth | tourists,all_features,rf,45.0,"{""bootstrap"": true, ""max_depth"": 20, ""max_features"": 0.7, ""min_samples_leaf"": 3, ""min_samples_split"": 10, ""n_estimators"": 300}",1.0,COMPLETE
88,8.696219951763288,2026-04-03 18:50:28.063993,2026-04-03 18:50:30.756025,0 days 00:00:02.692032,all_features,,,,,,,rf,True,20.0,0.7,2.0,8.0,800.0,6.3313669059635265,0.6678309739875044,8.696219951763288,0.966811460997246,dist_nearest_labeled_city | log1p_dist_nearest_labeled_city | crime_nearest_labeled_city | safety_nearest_labeled_city | same_country_as_nearest_labeled | avg_crime_k5 | avg_safety_k5 | avg_crime_k10 | avg_safety_k10 | wavg_crime_k5 | wavg_safety_k5 | log1p_num_labeled_within_50km | log1p_num_labeled_within_100km | log1p_num_labeled_within_250km | avg_crime_same_country_k5 | avg_safety_same_country_k5 | log1p_num_same_country_within_250km | log1p_num_cities_50km | log1p_sum_pop_50km | log1p_pop_gravity_50km | log1p_num_cities_100km | log1p_sum_pop_100km | log1p_pop_gravity_100km | dist_to_nearest_large_city | log1p_dist_to_nearest_large_city | log1p_pop_of_nearest_large_city | lat | lon | crimeindex_2020 | crimeindex_2023 | safetyindex_2020 | age_0_14 | age_15_64 | age_65_plus | population | density_per_km2 | gdp | gdp_per_capita | unemployment | homicide_rate | life_expectancy_male | life_expectancy_female | infant_mortality | urban_population_growth | tourists,all_features,rf,45.0,"{""bootstrap"": true, ""max_depth"": 20, ""max_features"": 0.7, ""min_samples_leaf"": 2, ""min_samples_split"": 8, ""n_estimators"": 800}",1.0,COMPLETE
89,9.99813927071645,2026-04-03 18:50:30.756704,2026-04-03 18:50:32.089905,0 days 00:00:01.333201,all_features,,,,,,,rf,False,,0.7,2.0,8.0,800.0,,,,,,,,,,,PRUNED
90,13.65210112697676,2026-04-03 18:50:32.090561,2026-04-03 18:50:35.047244,0 days 00:00:02.956683,geo_only,tanh,0.00011924539027540152,256.0,"(256, 128)",0.0007435463963997201,2.38597042248051e-05,mlp,,,,,,,,,,,,,,,,,PRUNED
91,8.701508553346557,2026-04-03 18:50:35.047960,2026-04-03 18:50:37.726049,0 days 00:00:02.678089,all_features,,,,,,,rf,True,20.0,0.7,2.0,9.0,800.0,6.349217980340066,0.6674855361689327,8.701508553346557,0.974778852847272,dist_nearest_labeled_city | log1p_dist_nearest_labeled_city | crime_nearest_labeled_city | safety_nearest_labeled_city | same_country_as_nearest_labeled | avg_crime_k5 | avg_safety_k5 | avg_crime_k10 | avg_safety_k10 | wavg_crime_k5 | wavg_safety_k5 | log1p_num_labeled_within_50km | log1p_num_labeled_within_100km | log1p_num_labeled_within_250km | avg_crime_same_country_k5 | avg_safety_same_country_k5 | log1p_num_same_country_within_250km | log1p_num_cities_50km | log1p_sum_pop_50km | log1p_pop_gravity_50km | log1p_num_cities_100km | log1p_sum_pop_100km | log1p_pop_gravity_100km | dist_to_nearest_large_city | log1p_dist_to_nearest_large_city | log1p_pop_of_nearest_large_city | lat | lon | crimeindex_2020 | crimeindex_2023 | safetyindex_2020 | age_0_14 | age_15_64 | age_65_plus | population | density_per_km2 | gdp | gdp_per_capita | unemployment | homicide_rate | life_expectancy_male | life_expectancy_female | infant_mortality | urban_population_growth | tourists,all_features,rf,45.0,"{""bootstrap"": true, ""max_depth"": 20, ""max_features"": 0.7, ""min_samples_leaf"": 2, ""min_samples_split"": 9, ""n_estimators"": 800}",1.0,COMPLETE
92,8.701508553346558,2026-04-03 18:50:37.726709,2026-04-03 18:50:40.399402,0 days 00:00:02.672693,all_features,,,,,,,rf,True,20.0,0.7,2.0,9.0,800.0,6.349217980340066,0.6674855361689327,8.701508553346558,0.9747788528472722,dist_nearest_labeled_city | log1p_dist_nearest_labeled_city | crime_nearest_labeled_city | safety_nearest_labeled_city | same_country_as_nearest_labeled | avg_crime_k5 | avg_safety_k5 | avg_crime_k10 | avg_safety_k10 | wavg_crime_k5 | wavg_safety_k5 | log1p_num_labeled_within_50km | log1p_num_labeled_within_100km | log1p_num_labeled_within_250km | avg_crime_same_country_k5 | avg_safety_same_country_k5 | log1p_num_same_country_within_250km | log1p_num_cities_50km | log1p_sum_pop_50km | log1p_pop_gravity_50km | log1p_num_cities_100km | log1p_sum_pop_100km | log1p_pop_gravity_100km | dist_to_nearest_large_city | log1p_dist_to_nearest_large_city | log1p_pop_of_nearest_large_city | lat | lon | crimeindex_2020 | crimeindex_2023 | safetyindex_2020 | age_0_14 | age_15_64 | age_65_plus | population | density_per_km2 | gdp | gdp_per_capita | unemployment | homicide_rate | life_expectancy_male | life_expectancy_female | infant_mortality | urban_population_growth | tourists,all_features,rf,45.0,"{""bootstrap"": true, ""max_depth"": 20, ""max_features"": 0.7, ""min_samples_leaf"": 2, ""min_samples_split"": 9, ""n_estimators"": 800}",1.0,COMPLETE
